tweet_id,clean_tweet,user_id,lat,long,city,country,state,state_code,political_label,label_score,stance
1.322223755582677e+18,vote republicans out of office trump doesnt care about your welfare and the least he cares about is your base,37645589.0,40.7348246,-73.79346679999999,New York,United States of America,New York,NY,Welfare,0.7768406271934509,Weakly Supports
1.3222270752107151e+18,biden trump wut,4032636423.0,28.5421109,-81.3790304,Orlando,United States of America,Florida,FL,Welfare,0.4267890751361847,Neutral
1.3222490719527365e+18,posted thered lol trump2020 conservative conservativememes funny politics politicalmemes usa draintheswamp trump presidenttrump red redkingdom meme biden bidenharris2020 blm alivesmatter blacklivesmatter hilarious,114923863.0,32.7174209,-117.1627714,San Diego,United States of America,California,CA,Welfare,0.4072618782520294,Neutral
1.3222558561850737e+18,when you claim trump doesnt support america helping them wcovid assistance please name one thing he hasnt done that biden wants to do,2891003632.0,32.7174209,-117.1627714,San Diego,United States of America,California,CA,Welfare,0.5876994729042053,Neutral
1.3222858040105247e+18,stop trump officials end graywolves wolf protections across most of us,246138191.0,40.7127281,-74.0060152,New York,United States of America,New York,NY,Welfare,0.474419355392456,Weakly Supports
1.3224628526372209e+18,so do conservatives not partake in halloween i mean cause theyre basically walking there kids from door to door asking for handouts shouldnt they tell their kids to get a job and buy their own candy trump maga2020,1179231290.0,40.9699889,-77.72788309999999,,United States of America,Pennsylvania,PA,Welfare,0.5927978754043579,Neutral
1.3225699632075612e+18,rich got richer andwateriswet us billionaires got a trillion dollars richer during trumps first term as president finance money wealth stockmarket earnings wealthgap,1206091106.0,38.8949924,-77.0365581,Washington,United States of America,District of Columbia,DC,Welfare,0.4862551093101501,Weakly Supports
1.3225703209271665e+18,muchos optando por quedarse en casa para halloween estn recurriendo a las piatas para celebrar la tendencia ha sido de gran beneficio para emprendedores hispanos que se dedican a la venta de estas halloween pandemia trump covid piatas,419785296.0,30.2711286,-97.7436995,Austin,United States of America,Texas,TX,Welfare,0.4174834191799164,Weakly Supports
1.3226355985663222e+18,president donaldtrump weloveyou,379190650.0,36.7014631,-118.7559974,,United States of America,California,CA,Welfare,0.4252358078956604,Neutral
1.3226380970169016e+18,wt trump,17100498.0,40.0757384,-74.4041622,,United States of America,New Jersey,NJ,Welfare,0.4274293482303619,Neutral
1.3226802663981998e+18,do trump supporters really think he cares about their welfare vote the liar and cheat out gop,9.638699228403958e+17,45.5202471,-122.6741949,Portland,United States of America,Oregon,OR,Welfare,0.7871977090835571,Weakly Supports
1.3227904766054646e+18,biden trump washingtondc turnout prediction,2244592758.0,40.0149856,-105.2705456,Boulder,United States of America,Colorado,CO,Welfare,0.4682299494743347,Neutral
1.3229390994105344e+18,great conversation about the remake of the republican party trump republicans really a fairly simple concept put the long term welfare of the usa first in any policy consideration bidenharris2020landslide trump,113637553.0,40.9699889,-77.72788309999999,,United States of America,Pennsylvania,PA,Welfare,0.7430760860443115,Neutral
1.3229543591189012e+18,effectpotus oath of office a promise trump did not keep to preserve protect and defend the constitution of the united states cites promotion of the general welfare as a primary reason forthe constitution maga this broken oath does not deserve our vote,116295335.0,41.6500201,-72.7342163,,United States of America,Connecticut,CT,Welfare,0.5888688564300537,Neutral
1.3229551210897613e+18,effectpotus broke his oath of office promise to preserve protect and defend the constitution of the united states cites promotion of the general welfare as a primary reason forthe constitution is this what maga means to you trump does not deserve our vote,116295335.0,41.6500201,-72.7342163,,United States of America,Connecticut,CT,Welfare,0.7779964804649353,Weakly Supports
1.3229707015827948e+18,most trump supporters are welfare queens,7.649666876112937e+17,41.875561600000005,-87.6244212,Chicago,United States of America,Illinois,IL,Welfare,0.7023747563362122,Weakly Supports
1.323004893196624e+18,wheredidgavingo stayawaynewsom california trump maybe he went to dc to watch trump win live,2324823740.0,31.8160381,-99.5120986,,United States of America,Texas,TX,Welfare,0.5597963929176331,Neutral
1.3230132663108608e+18,the almighty speaks again more straw bosses called rappers but they say their looking out for our economical welfare what a joke all you rappers trump will use you then throw you away,869081676.0,38.6264178,-90.1998378,St. Louis,United States of America,Missouri,MO,Welfare,0.6454129219055176,Neutral
1.3230516224450765e+18,we are still the usa trump cannot overcome,23714644.0,40.7127281,-74.0060152,New York,United States of America,New York,NY,Welfare,0.4242418110370636,Weakly Supports
1.3230619580446925e+18,remember the truman train last minute campaigning that allowed him to defy the polls and the odds to beat dewey although a different party you are showing that fighting spirit and will do it again votered trump trump2020landslide,7.826802331995382e+17,43.4849133,-71.6553992,,United States of America,New Hampshire,NH,Welfare,0.5982996821403503,Neutral
1.3230737257432635e+18,well be so victorious if trump wins another term we just cant get cocky godswillbedone faith hope trump2020,458882374.0,36.1672559,-115.1485163,Las Vegas,United States of America,Nevada,NV,Welfare,0.562798023223877,Neutral
1.3230923415241892e+18,the 100 cringeworthiest trump moments if you havent already voted watch this video first then vote courtesy of,35766965.0,29.7589382,-95.3676974,Houston,United States of America,Texas,TX,Welfare,0.4247884154319763,Neutral
1.3230967842274757e+18,i dunno maybe if youre writing about trump farmers who decry a welfare stateyou might mention farmers in the county youre reporting from received 36m in subsidies last year in a state that ranked 5th in overall farm welfare seems relevant,10953362.0,32.9299655,-97.2271249,,United States of America,Texas,TX,Welfare,0.5497060418128967,Neutral
1.323104150805205e+18,yeah nothing to be concerned about here just the president fortifying the wh while his supporters aka right wing terrorists attack his opponents campaign totally normal election2020 trump bidenharristosaveamerica,8.414627582479196e+17,43.157285,-77.615214,Rochester,United States of America,New York,NY,Welfare,0.5131175518035889,Neutral
1.3232570538555515e+18,trump votered godwins,1.2599229715038577e+18,27.7567667,-81.4639835,,United States of America,Florida,FL,Welfare,0.4779315590858459,Neutral
1.3233083355553505e+18,all over the country we have suffering children and this in large part is due to trump team lack of concern for child welfare including good nutrition quality health care including mental health care good schools healthy lands has led to destruction,208607949.0,42.3788774,-72.03236600000001,,United States of America,Massachusetts,MA,Welfare,0.7276326417922974,Weakly Supports
1.3233322373543936e+18,im so happy for you god is good trump familytimes,2871235230.0,27.747725300000003,-97.4014129,Corpus Christi,United States of America,Texas,TX,Welfare,0.49441659450531,Strongly Supports
1.32334249920999e+18,i still have republican friends who support trump they know i cant stand the guy but if they needed help i would be there for them and vice versa you dont throw away friends amp family bc of politics trump biden elections electionday,310870318.0,39.8211225,-105.220743,Arvada,United States of America,Colorado,CO,Welfare,0.5066484808921814,Neutral
1.323404674867888e+18,welfare state and open borders can not coexist election2020 trump,8.490411944957297e+17,40.8517224,-73.0992188,,United States of America,New York,NY,Welfare,0.6643799543380737,Weakly Supports
1.3234090570136412e+18,trump wants to kill endangered wolves so well make portland a safe space for wolves restore the wolf population in forest park savethewolves we can do this planforprogress,1.323383581343801e+18,45.5202471,-122.6741949,Portland,United States of America,Oregon,OR,Welfare,0.738419234752655,Weakly Supports
1.3234103102550712e+18,no i dont believe in handouts thats socialismcommunism thats not what this country is about imagine working hard your whole life saving up to buy your dream house and then the gov builds an affordable housing apartment block next door thats bullshit trump,9.494914920029144e+17,26.1223084,-80.14337859999999,Fort Lauderdale,United States of America,Florida,FL,Welfare,0.4198874831199646,Neutral
1.3234132571434803e+18,trump wants to kill endangered wolves so well make portland a safe space for wolves restore the wolf population in forest park savethewolves we can do this,1.323383581343801e+18,45.5202471,-122.6741949,Portland,United States of America,Oregon,OR,Welfare,0.7690010070800781,Weakly Supports
1.3234385381599887e+18,speriamo usa2020 biden trump,354125985.0,38.6920451,-75.4013315,,United States of America,Delaware,DE,Welfare,0.4090551137924194,Neutral
1.323468722766549e+18,awesomeness trump maga 2020,23492641.0,29.4246002,-98.4951405,San Antonio,United States of America,Texas,TX,Welfare,0.4753575623035431,Strongly Supports
1.3234828171378156e+18,heh playlist goes to everybodys workin for the weekend i see what youre doing there trump preshow playlist master and i thank you for it,8436472.0,45.5202471,-122.6741949,Portland,United States of America,Oregon,OR,Welfare,0.4096337258815765,Neutral
1.323606120175489e+18,let the best candidate who has the wellbeing of the common american from utah to san francisco win let a nation builder who would make america great again win electionday trump biden,1.185036889851609e+18,29.7589382,-95.3676974,Houston,United States of America,Texas,TX,Welfare,0.5297889113426208,Neutral
1.3236446052717814e+18,boom usa trump,1.2258919909503672e+18,34.0980031,-118.329523,Los Angeles,United States of America,California,CA,Welfare,0.570027768611908,Neutral
1.3236493590792645e+18,thank god trumps not interested in playing games,19132899.0,40.0757384,-74.4041622,,United States of America,New Jersey,NJ,Welfare,0.4536552131175995,Neutral
1.3236927899856118e+18,was auch immer in den kommenden tagen stunden und tagen passieren wird der bahnhof von wilmington in delaware trgt joe bidens namen und im bahnhofsladen gibt es trump wie biden devotionalien mit 50 prozent rabatt uswahlen2020 election2020,322742682.0,38.8949924,-77.0365581,Washington,United States of America,District of Columbia,DC,Welfare,0.4685402512550354,Weakly Supports
1.323697212740694e+18,while trump may say that covid19 is not his fault this research shows his disregard for safety and wellbeing for others may have directly led to 30k cases and 700 deaths votehimoutandlockhimup,74878423.0,34.0536909,-118.242766,Los Angeles,United States of America,California,CA,Welfare,0.4716456532478332,Neutral
1.323728499736146e+18,we will win godwins trump was the chosen one,301712105.0,64.44596130000001,-149.680909,,United States of America,Alaska,AK,Welfare,0.5888454914093018,Neutral
1.3237470693000356e+18,dickes dankeschn an und fr das tolle gesprch ber gary cooper southern belles atlanta trump biden und die uswahlen2020 mein highlight am electionday2020,3241711122.0,33.749098700000005,-84.39018490000001,Atlanta,United States of America,Georgia,GA,Welfare,0.6552087068557739,Neutral
1.3237653662003732e+18,i find it hilarious that trump supporters bitch about migrant workers somehow getting welfare without fucking social security numbersthe fact is these people are taking your jobs because youre a bunch of lazy idiotsthey dont need your help let them be,9.918115387125146e+17,27.7567667,-81.4639835,,United States of America,Florida,FL,Welfare,0.5815457701683044,Neutral
1.323810118757208e+18,welpit looks like 4 more years of trump i am calling it a night,1.0936492095748096e+18,42.6839894,-71.11270649999999,,United States of America,Massachusetts,MA,Welfare,0.6544762253761292,Neutral
1.3238182420712694e+18,byw i still stand by that i think trump will win the election and popular vote but someone was like what if bidenharris2020 wins the electoral college but trump2020 wins the popular vote election2020 elections2020,1.2406445159347855e+18,40.2253569,-82.6881395,,United States of America,Ohio,OH,Welfare,0.5500085949897766,Neutral
1.323840769699025e+18,awesomeness trump maga 2020,23492641.0,29.4246002,-98.4951405,San Antonio,United States of America,Texas,TX,Welfare,0.4753586053848266,Strongly Supports
1.323846553803526e+18,it is no longer about whether trump has any decency but if we do votewithkindness biden2020,419034802.0,36.7014631,-118.7559974,,United States of America,California,CA,Welfare,0.4837143719196319,Neutral
1.323848701505319e+18,whowins biden trump,1629543416.0,39.7459468,-75.546589,Wilmington,United States of America,Delaware,DE,Welfare,0.6450921893119812,Neutral
1.323868252301369e+18,you can go to bed now i predict trump wins 292 trump to 246 biden prediction election2020 protecttheresults electoralcollege electionnight electionresults electionresults2020,1.0011557309032694e+18,27.7567667,-81.4639835,,United States of America,Florida,FL,Welfare,0.498443067073822,Neutral
1.3238854189459087e+18,you can go to bed now i predict trump wins 286 trump to 252 biden prediction election2020 protecttheresults electoralcollege electionnight electionresults electionresults2020,1.0011557309032694e+18,27.7567667,-81.4639835,,United States of America,Florida,FL,Welfare,0.4697450697422027,Neutral
1.3238884912694436e+18,er macht es trump unterstellt wahlbetrug uselection,1568063310.0,38.8949924,-77.0365581,Washington,United States of America,District of Columbia,DC,Welfare,0.6527239084243774,Neutral
1.323973485505532e+18,president trumps trade war with china did not achieve its goal of reversing the downward trend in american manufacturing jobs according to the wsjpresident trumps trade war with china did not achieve its goal of reversing the downward trend in american manufacturing job,9.918943408627098e+17,42.3788774,-72.03236600000001,,United States of America,Massachusetts,MA,Welfare,0.4382035136222839,Neutral
1.3240392693217116e+18,trump fought to keep all those automobile jobs in detroit then all those ungrateful toads vote for biden well i hope they enjoy the next 4 yearson welfare,29615013.0,33.749098700000005,-84.39018490000001,Atlanta,United States of America,Georgia,GA,Welfare,0.8187854886054993,Neutral
1.3240913623885783e+18,thepostelection uselection2020 elections2020 getwellsoonjisung mufc lockdownuk trumpvsbidenfight lockdown counteveryvote casino losandes trumpcovid19 biden2020 trump2020 biden trump getwellsoonjisung hiphopawards,1.2590266805820047e+18,34.0536909,-118.242766,Los Angeles,United States of America,California,CA,Welfare,0.6604055166244507,Neutral
1.324133470826754e+18,ive always felt that we died on 911 2020 and beyond is the epilogue for the fall of the original usa founded in 1776 trump,824452920.0,47.6038321,-122.3300624,Seattle,United States of America,Washington,WA,Welfare,0.4642746448516845,Neutral
1.3241503343322767e+18,donaldtrump already owes millions now hes going to ask for charity to pay for all these lawsuits which will all fail just like he did,381823563.0,36.1672559,-115.1485163,Las Vegas,United States of America,Nevada,NV,Welfare,0.4270070195198059,Weakly Supports
1.324333635235971e+18,is desperately trying to soothe trump,1897239480.0,44.5990718,-72.5002608,,United States of America,Vermont,VT,Welfare,0.5470873713493347,Weakly Supports
1.3243908746719478e+18,eww biden positive trump negative,14853681.0,35.7730076,-86.28200809999998,,United States of America,Tennessee,TN,Welfare,0.6901063323020935,Neutral
1.324483673652142e+18,true baby girl but after all the crap said by trump about latinos as rapists bad hombres welfare rip offs shthle ppl why would so many latinx vote for this man who so obviously hates and despised the good people from mexico cuba nicaragua venezuela puerto ricodr,2422604581.0,41.875561600000005,-87.6244212,Chicago,United States of America,Illinois,IL,Welfare,0.6523719429969788,Weakly Supports
1.3245039448491418e+18,wheres mike pence trump,308206506.0,38.8937936,-76.98799759999999,,United States of America,District of Columbia,DC,Welfare,0.648475706577301,Neutral
1.3245211340800983e+18,thought it was weird for trump to use the wh as his campaign hq youre not alone federal watchdog probing trump campaigns use of white house lawmaker reuters,2233128121.0,38.8949924,-77.0365581,Washington,United States of America,District of Columbia,DC,Welfare,0.5070863962173462,Neutral
1.3245441020258304e+18,at shewins we teach our girls to take any loss as a lesson and to accept defeat with dignity amp grace we hope adults in government would do the same elections2020 trump electionresults2020 counteveryvote allvotesmatter trumpmeltdown,3246075198.0,40.735657,-74.1723667,Newark,United States of America,New Jersey,NJ,Welfare,0.4261923432350158,Neutral
1.3245461238103777e+18,wheres ur god now trump,1169087875.0,42.3788774,-72.03236600000001,,United States of America,Massachusetts,MA,Welfare,0.442606121301651,Neutral
1.3246874816195174e+18,watch mein neues interview zur uswahl der markt ist parteiisch brse trump biden election2020 election electionday wahl wahlen usa wirtschaft brse,29105288.0,40.7127281,-74.0060152,New York,United States of America,New York,NY,Welfare,0.5778669118881226,Neutral
1.324729772514009e+18,trump campaign statement wewillwin,9.021790900435148e+17,36.7014631,-118.7559974,,United States of America,California,CA,Welfare,0.5862314701080322,Neutral
1.3247382562028503e+18,ah yes a trump sooth aged like whole milk,3506124973.0,30.2711286,-97.7436995,Austin,United States of America,Texas,TX,Welfare,0.6052570939064026,Weakly Supports
1.3247525887100518e+18,will the winner of the presidential election be declared today counteveryvote election2020 election2020results elections2020 getwellsoonyoongi electionresults philadelphia joebiden donaldtrump,537514081.0,38.8949924,-77.0365581,Washington,United States of America,District of Columbia,DC,Welfare,0.4182199537754059,Neutral
1.324754288581714e+18,wethepeople if democrats steal election this is the play america retires specialelection runs for the open spot ky kentucky elects trump and then gets elected senate leader hannity tucker electionresults2020,1421798791.0,36.9903199,-86.4436018,Bowling Green,United States of America,Kentucky,KY,Welfare,0.5951342582702637,Neutral
1.324773724734714e+18,ach mein amerika politik donaldtrump joebiden election2020 electionresults2020 wahlkampf wahlen usa uswahl,41935019.0,37.804455700000005,-122.2713563,Oakland,United States of America,California,CA,Welfare,0.4657110273838043,Neutral
1.324776845888336e+18,ask dejoy dejoy usps trump,186226125.0,40.8254914,-73.681282,,United States of America,New York,NY,Welfare,0.6007885336875916,Strongly Supports
1.3248384467586867e+18,any word if this is true johncena trump wwe,339726285.0,36.7014631,-118.7559974,,United States of America,California,CA,Welfare,0.5607267022132874,Weakly Supports
1.3248667128613356e+18,hunter becomes the hunted mother zebra save her newborn from lion giraffe vs lion donaldtrump joebiden,1.3203280663721288e+18,40.7127281,-74.0060152,New York,United States of America,New York,NY,Welfare,0.4478691816329956,Neutral
1.32488684469427e+18,im sorry that trump drove the usfl into bankruptcy i respect you as a player winning humbly losing graciously makes you a winner dont be poisoned by trumps convoluted logic he wont overturn this election even with his bought and paid for supreme court justices,49730516.0,40.7127281,-74.0060152,New York,United States of America,New York,NY,Welfare,0.475161999464035,Neutral
1.324923503397675e+18,godwinsalways trump,7.382460517363917e+17,33.6170092,-117.92944009999998,,United States of America,California,CA,Welfare,0.4365043342113495,Neutral
1.324923970693591e+18,can you imagine if trump made a speech in 2016 calling for unity and working together yeah me neither i cant wait for presidentelect biden to get to work im so tired of my president hating me and his supporters being complete dickheads to everyone rememberwhoweare,1365809784.0,43.157285,-77.615214,Rochester,United States of America,New York,NY,Welfare,0.4491559863090515,Weakly Supports
1.3249874227032842e+18,saying trump will never let you down and is never going to fail is idol worship trump is human weareallhuman romans323,1.3078781899440005e+18,39.950724,-86.2616968,,United States of America,Indiana,IN,Welfare,0.5944733023643494,Weakly Supports
1.3250651273438904e+18,saturdaythoughts people want a bidenharris admin biden2020 not in florida but fakenews is promoting violence against trump supporters browardcounty florida floriduh sent from wsvn,468930205.0,26.1598074,-80.4623642,,United States of America,Florida,FL,Welfare,0.4205902516841888,Neutral
1.3250886513746289e+18,travel strong safe lifeships trump team is a sinking ship,208607949.0,42.3788774,-72.03236600000001,,United States of America,Massachusetts,MA,Welfare,0.7541964650154114,Neutral
1.3251038189384417e+18,prsident trump hat das weie haus vor rund einer stunde verlassen sportlich gekleidet spielt golf in seinem club in virginia hoffentlich lassen sie ihn gewinnen uswahlen2020,873367008.0,38.8949924,-77.0365581,Washington,United States of America,District of Columbia,DC,Welfare,0.7537016868591309,Neutral
1.3251044114971566e+18,trump the wile e coyote of presidents,1.306796049294676e+18,38.2493581,-122.0399663,Fairfield,United States of America,California,CA,Welfare,0.4490203857421875,Neutral
1.3251197349883658e+18,welp biden wonsobye trump i mean,253948026.0,40.8506558,-73.86652409999999,New York,United States of America,New York,NY,Welfare,0.6932184100151062,Neutral
1.3251238599269622e+18,perfectly befitting the only two things trump ever did while presidenttweet amp golf goodbye amp good riddance ya nogood donothin lazya welfare queen sad loser,2347940717.0,34.2331373,-102.4107493,,United States of America,Texas,TX,Welfare,0.4906862080097198,Weakly Opposes
1.3251297053227336e+18,wellnesscheck order for donaldtrump bye felicia,8.19189994128425e+17,33.9562003,-118.353132,Inglewood,United States of America,California,CA,Welfare,0.5807818174362183,Neutral
1.3251328144596255e+18,your support for biden was wholesome for realthank you you showed us that country comes far before than presidential candidacy election2020 election2020results pennsylvania2020 bidenharris2020 trump biden2020 bidenharristoendthisnightmare,1.144605118471344e+18,37.226611,-121.9746797,,United States of America,California,CA,Welfare,0.669874906539917,Neutral
1.3251361085696983e+18,postbote eben zu uns see we did get those ballots in uselection uswahlen2020 biden trump,89139063.0,40.7127281,-74.0060152,New York,United States of America,New York,NY,Welfare,0.6005297899246216,Neutral
1.32513802737988e+18,as he is declared the election2020 loser hes golfing how very on brand he has never been willing to do any work to earn anything in his miserable life and now hes crying that hell ask courts to give him a handout somehow go away yourefired trump joebiden,715381372.0,33.687438799999995,-80.4363743,,United States of America,South Carolina,SC,Welfare,0.4498931765556335,Neutral
1.3251466809545157e+18,dear trump supporters the world didnt just end you are okay and please take your dang trump flags down fine lower them to half mast if you must and then take them down i dont actually care about your guns at this moment but those need to go xoxoxo bidenharis2020,14533632.0,29.949932300000004,-90.0701156,New Orleans,United States of America,Louisiana,LA,Welfare,0.4388598799705505,Weakly Supports
1.3251487531755725e+18,trump iswell presidentelectbiden,361322792.0,38.6264178,-90.1998378,St. Louis,United States of America,Missouri,MO,Welfare,0.5987178683280945,Neutral
1.325149607924441e+18,congratulations and thank you please i pray you sweet the wh for bugs and any other nefarious devices the trump camp may have left behind in the go residence too exterminate,8.826483966239498e+17,42.3788774,-72.03236600000001,,United States of America,Massachusetts,MA,Welfare,0.6079920530319214,Neutral
1.3251516640686776e+18,not to worry you will still get to live rent free in government housing trump electionresults2020,16800049.0,39.9622601,-83.00070649999999,Columbus,United States of America,Ohio,OH,Welfare,0.4482752680778503,Neutral
1.3251717220986348e+18,der nochprsident ist zurck im weien haus keine erbauliche rckfahrt vom golfclub vermutlich trump biden uswahlen2020,873367008.0,38.8949924,-77.0365581,Washington,United States of America,District of Columbia,DC,Welfare,0.4039011299610138,Neutral
1.325183478682579e+18,trump was stunned by pennsylvania predicted by wwe in 2016 election biden presidentbiden,102147262.0,40.9699889,-77.72788309999999,,United States of America,Pennsylvania,PA,Welfare,0.5559875965118408,Neutral
1.3251884274411684e+18,bye felicia trump trump2020,8.467744398072709e+17,41.875561600000005,-87.6244212,Chicago,United States of America,Illinois,IL,Welfare,0.4052781760692596,Neutral
1.325194210077778e+18,one of the reasons some latinos still vote democrat is because theyre scare of losing food stamps or any benefit they can get for being lazy one girl once told me i dont need to get another job ill just get ebt and wic thats what those people love being leeches trump,834587455.0,26.1908241,-97.6959794,Harlingen,United States of America,Texas,TX,Welfare,0.6627669930458069,Neutral
