tweet_id,clean_tweet,user_id,lat,long,city,country,state,state_code,political_label,label_score,stance
1.3236652985164513e+18,trump maga maga2020 foxnews trump2020 fourmoreyears trump2020landslide republicanparty republicans cnn trumplandslide elecciones2020 djt exec order making it easier to fire fed employees is mtng resistance within the food amp drug adm fears wh is planning a purge,1.3166283945414246e+18,40.7596198,-111.8867975,Salt Lake City,United States of America,Utah,UT,Unemployment,0.4121540486812591,Weakly Supports
1.3236665208458035e+18,if trump worked for you he would not have ignored pandemic warnings lied about severity neglected health careeducation needs inspired domestic terrorism incited violence rolled back environmental supports divided usa wangrydemeaning lies devastating unemployment,208607949.0,42.3788774,-72.03236600000001,,United States of America,Massachusetts,MA,Unemployment,0.483065128326416,Weakly Supports
1.323668240887853e+18,poverty in america is top 1 globally kag2020 trump acab,1.2853884276351672e+18,27.9477595,-82.458444,Tampa,United States of America,Florida,FL,Unemployment,0.4940657317638397,Weakly Opposes
1.323672891490095e+18,season finale of presidential apprentice tonight watch as america tells youre fired yourefired americasgreatestmistake covid19 trumpvirus trumpmeltdown trump msnbc2020,1.1110631312565536e+18,38.8949924,-77.0365581,Washington,United States of America,District of Columbia,DC,Unemployment,0.491228312253952,Weakly Supports
1.3236802380863488e+18,everyone at cnn and msnbc secretly voting trump cause what else would they have to cover otherwise theyd be out of work vote election2020,1.1973325164384543e+18,40.7896239,-73.9598939,New York,United States of America,New York,NY,Unemployment,0.5093322992324829,Weakly Supports
1.3236901564198052e+18,if trump is out deutsche bank feels it will demand repayment foreclose if he is not able to pay it off or refinance or try to sell the loans since trump has personally guaranteed all loans deutsche bank could seize the presidents assets if he is unable to repay trump,25967016.0,19.5872677,-155.42688969999998,,United States of America,Hawaii,HI,Unemployment,0.5395277142524719,Weakly Supports
1.323701557846778e+18,the laziest president in history trumpgop admin 40m risking eviction 8m fallen into poverty 126m unemployed 12m lost healthcare 238k deaths covid19 trilliondollar deficits recession 215 criminal indictments tax fraud retweet amp follow,441278306.0,40.7127281,-74.0060152,New York,United States of America,New York,NY,Unemployment,0.4302864968776703,Weakly Supports
1.3237126121824666e+18,trump perder nunca es fcil estadosunidos donaldtrump,21104432.0,38.8949924,-77.0365581,Washington,United States of America,District of Columbia,DC,Unemployment,0.6065629720687866,Neutral
1.3237129310963835e+18,its a great day in america god said you about to lose yo jobalso god said donaldtrump goin to prison election2020 election vote vote2020 votehimout voteforchange voteblue2020 bidenharris2020 biden2020 joebiden,243262435.0,33.749098700000005,-84.39018490000001,Atlanta,United States of America,Georgia,GA,Unemployment,0.4650010168552398,Weakly Supports
1.3237293692741632e+18,i bet we can find plenty of deplorables to help them pack and i know theres a trump truck parade in tx ready to give an escort,7.871248349876797e+17,29.7589382,-95.3676974,Houston,United States of America,Texas,TX,Unemployment,0.4022344350814819,Weakly Supports
1.3237327510658335e+18,jobs not done therealdonaldtrump joebiden usaelections2020 losangeles lakers lakersnation dodgers dodgersnation presidentialelection joerogan america trump biden,290005672.0,34.0536909,-118.242766,Los Angeles,United States of America,California,CA,Unemployment,0.5232788920402527,Weakly Opposes
1.3237580524539658e+18,soon they will all be without a job if they put on their resume worked for trump they will have a hard time finding work where good people are employed,6460032.0,43.9792797,-120.737257,,United States of America,Oregon,OR,Unemployment,0.5114792585372925,Weakly Opposes
1.3237706541103063e+18,youre fired donaldtrump electionday,349296947.0,34.0536909,-118.242766,Los Angeles,United States of America,California,CA,Unemployment,0.5103703141212463,Weakly Opposes
1.3237822685702267e+18,cierran los primeros colegios electorales en estados unidos impactolatino elecciones2020 colegioselectorales estadosunidos trump joebiden,84963978.0,40.7127281,-74.0060152,New York,United States of America,New York,NY,Unemployment,0.4404192566871643,Weakly Supports
1.3238029960738816e+18,nc is tilting trump,39440029.0,43.1561681,-75.84499459999999,,United States of America,New York,NY,Unemployment,0.4549257159233093,Weakly Opposes
1.3238111288462254e+18,saying that the trump admin is very worried right now in the whitehouse they should be lets remember all the families that lost their jobs amp homes from the govnt shutdown amp poor handling of the coronavirus electionday election2020 votehimout vote2020,807041486.0,31.8160381,-99.5120986,,United States of America,Texas,TX,Unemployment,0.410161942243576,Weakly Supports
1.3238240837258568e+18,looking like 4 more years just had to wait for the trump voters to get out of work trump2020 trump,9.896905994136166e+17,43.6211955,-84.6824346,,United States of America,Michigan,MI,Unemployment,0.7388560771942139,Weakly Supports
1.323826070718714e+18,la tensin y ansiedad se vive en suelo americano ante dos candidatos muy opuestos ideolgicamente se trata de un proceso electoral histrico que se produce en plena crisis pandmica y econmica elecciones trump eeuu electionnight elecciones2020 estadosunidos joebiden,1.2786568401806008e+18,25.7741728,-80.19362,Miami,United States of America,Florida,FL,Unemployment,0.4360061585903168,Weakly Supports
1.3238269961331712e+18,noliesdetected usaelections2020 trump uselection2020 electionnight elections2020,471599209.0,39.95233,-75.16379,,United States of America,Pennsylvania,PA,Unemployment,0.4437052011489868,Weakly Supports
1.3238335982235238e+18,non solo trump sar il presidente crazynancy far la disoccupata,122733775.0,28.5977707,-81.35102640000001,,United States of America,Florida,FL,Unemployment,0.6040350794792175,Weakly Supports
1.323871778200957e+18,will trump mention the poor unfortunate poles again,8.179032968033116e+17,34.0536909,-118.242766,Los Angeles,United States of America,California,CA,Unemployment,0.4614576697349548,Weakly Opposes
1.3239203628919316e+18,unpresident trump,154017181.0,34.0536909,-118.242766,Los Angeles,United States of America,California,CA,Unemployment,0.4733276665210724,Weakly Opposes
1.3239856540118016e+18,seriously america said we want more of trump who killed 2700 americas during covid19 divided a nation and only provided 1200 to millions who are unemployedstill struggling to make ends meet thisisamerica roadto270 thisisamerika presidentialelection,1626534254.0,40.63439,-73.95026999999999,,United States of America,New York,NY,Unemployment,0.7495287656784058,Weakly Supports
1.323987687754371e+18,almost 23 million americans are on unemployment nearly 1 in 5 small businesses have closed their doors and millions of people are at risk of being evicted america simply cant afford another 4 years of donaldtrump bidenharris2020 elections2020,1050829615.0,37.7790262,-122.4199061,San Francisco,United States of America,California,CA,Unemployment,0.8435723185539246,Weakly Supports
1.3239951432849695e+18,pierde en california el congresista latino ms novel y aliado de trump impactolatino elecciones2020 california mikegarca trump estadosunidos,84963978.0,40.7127281,-74.0060152,New York,United States of America,New York,NY,Unemployment,0.5599640011787415,Weakly Supports
1.3239963504433316e+18,seoras y seores se acabo el conteo elecciones2020 estadosunidos usa trump biden estados unidos tiene nuevo presidente,1.0838155533394534e+18,31.8160381,-99.5120986,,United States of America,Texas,TX,Unemployment,0.5421316623687744,Weakly Supports
1.3240260033715569e+18,if the electoralmap holds trump becomes objectively the worst of all time he was impeached served one term never won the popular vote historically low approval rating never passed 50 first prez in 80 yrs to leave office with a net loss of jobs 2020election,339283438.0,38.8949924,-77.0365581,Washington,United States of America,District of Columbia,DC,Unemployment,0.4868476986885071,Weakly Supports
1.3240568150432686e+18,isnt it amazing that the american people get to tell youre fired counteveryvote biden trump,46417435.0,40.0757384,-74.4041622,,United States of America,New Jersey,NJ,Unemployment,0.5547890663146973,Weakly Supports
1.324072717835002e+18,breaking joe biden wins wisconsin unemployment coronavirus impeachedtrump donaldtrump worstpresidentinhistory mikepence aca covid19 theshaderoom worlsstar blackvotesmatter blacklivesmatter teambiden teamharris pictureoftheday ivotedearly votethemout blm,2948372832.0,39.7683331,-86.1583502,Indianapolis,United States of America,Indiana,IN,Unemployment,0.6323415040969849,Weakly Supports
1.3240768099614351e+18,that right and obama did nothing for the minority voters just like biden while trump had lowest unemployment for minorities in history now democrats want to take it back kamala laughed with her democrats about lock more black then anyone,1.1643213714652406e+18,34.8253019,-116.0833144,,United States of America,California,CA,Unemployment,0.4416996240615845,Weakly Supports
1.3240948204034744e+18,hm now that donaldtrump is not going to get my husband back to work i want a divorce suburbanwomenagainsttrump,1.244392183165141e+18,21.59116,-158.1094,,United States of America,Hawaii,HI,Unemployment,0.5834872722625732,Weakly Supports
1.3241040590585897e+18,breaking joe biden wins michigan unemployment coronavirus impeachedtrump donaldtrump worstpresidentinhistory mikepence aca covid19 theshaderoom worlsstar blackvotesmatter blacklivesmatter teambiden teamharris pictureoftheday ivotedearly votethemout blm,2948372832.0,39.7683331,-86.1583502,Indianapolis,United States of America,Indiana,IN,Unemployment,0.7093093991279602,Weakly Supports
1.3241046423015793e+18,i dont want to see one member of the donaldtrump show up as commentators on cnn msnbc fox etc they should remain jobless until their sentences are handed down by a jury of their peers,1.2714830343199826e+18,36.591171,-121.8848638,Monterey,United States of America,California,CA,Unemployment,0.6553038954734802,Weakly Opposes
1.3241113814199296e+18,4 bankruptcies 2 failed marriages and now he is fired from his job by 71 million people so much losing for trump,7.813586803567616e+17,44.9772995,-93.2654692,Minneapolis,United States of America,Minnesota,MN,Unemployment,0.7331618070602417,Weakly Supports
1.324111607312646e+18,donaldtrump youre fired,3132752803.0,41.875561600000005,-87.6244212,Chicago,United States of America,Illinois,IL,Unemployment,0.4722914099693298,Weakly Supports
1.324118239530623e+18,veterans for trump will highlight how president trump has delivered on his promise reform va inc signing key veterans legislation va mission act and the forever gi bill trump low unemployment rate among veterans ever,1.2337169623724196e+18,34.0536909,-118.242766,Los Angeles,United States of America,California,CA,Unemployment,0.7140060067176819,Strongly Supports
1.3241229195391468e+18,going out real sad loserinchief drumpf trump,7.547924894924186e+17,42.6511674,-73.754968,Albany,United States of America,New York,NY,Unemployment,0.4350367486476898,Weakly Supports
1.3241270991966003e+18,donaldtrump is near to to lose his job,340750015.0,36.1672559,-115.1485163,Las Vegas,United States of America,Nevada,NV,Unemployment,0.7120164632797241,Weakly Supports
1.3241430733795615e+18,loser youre fired trump donald fake news fake news fake news,1.1640227024092447e+18,36.7014631,-118.7559974,,United States of America,California,CA,Unemployment,0.5561122298240662,Weakly Supports
1.3241452780358943e+18,trump about to lose his job,1.2462625077963817e+18,45.98965870000001,-94.6113288,,United States of America,Minnesota,MN,Unemployment,0.7837143540382385,Weakly Supports
1.3241470735335506e+18,mientras se tabulan los votos de los estados pendientes ya sea que gane joe biden o se reelija donald trump la eleccin presidencial de 2020 evidencia muchas cosas en este pas dividido la donaldtrump elecciones2020 estadosunidos violencia,16387054.0,34.0536909,-118.242766,Los Angeles,United States of America,California,CA,Unemployment,0.4535626769065857,Weakly Supports
1.3241476387453133e+18,recession and loss of jobs have been happening under since march and destruction of our democracy under him since 11916 weve got along way to go to dig us out of the whole trump has put us in,256302227.0,41.875561600000005,-87.6244212,Chicago,United States of America,Illinois,IL,Unemployment,0.7849723696708679,Weakly Supports
1.32414809423838e+18,mientras se tabulan los votos de los estados pendientes ya sea que gane joe biden o se reelija donald trump la eleccin presidencial de 2020 evidencia muchas cosas en este pas dividido la donaldtrump elecciones2020 estadosunidos violencia,16387054.0,34.0536909,-118.242766,Los Angeles,United States of America,California,CA,Unemployment,0.4535626769065857,Weakly Supports
1.3241710213818532e+18,hello 4 gas hello sustained 10 unemployment rate hello tax increase for everyone goodbye peace in middle east how long before biden gets us into a new war thank a biden voter when these come true kag2020 kag trumpvsbiden trump,9.380271335484948e+17,38.475840600000005,-80.84084150000001,,United States of America,West Virginia,WV,Unemployment,0.4269757568836212,Weakly Supports
1.3241727098367631e+18,2300 dead americans and counting it didnt have to be this way thanks for nothing republicans trumpvirus trump gop maga,4132841.0,29.9978185,-83.2221527,,United States of America,Florida,FL,Unemployment,0.4068932831287384,Weakly Supports
1.3241899253323244e+18,where are you going to work after you get fired after trump is voted out maybe he will hire you at his private island you have no credibility amp morals,9.928908583399055e+17,36.7014631,-118.7559974,,United States of America,California,CA,Unemployment,0.6998258233070374,Weakly Supports
1.3242160561775493e+18,yes every american vote counts those on land and in sea fighting for our country and working for the unemployed pack your bags trump,1.236310458245636e+18,37.3361905,-121.890583,San Jose,United States of America,California,CA,Unemployment,0.5638965964317322,Weakly Opposes
1.3242326288039322e+18,lol trump is broke and unemployed,560386246.0,42.3602534,-71.0582912,Boston,United States of America,Massachusetts,MA,Unemployment,0.9349389672279358,Weakly Supports
1.3242418235697644e+18,people are crazy they act like trump is the messiah but he wouldnt even give these folks acknowledgement passing them on the street and definitely not a job,1.162118885388247e+18,39.9527237,-75.16352619999999,Philadelphia,United States of America,Pennsylvania,PA,Unemployment,0.4563659727573395,Weakly Supports
1.324246918759879e+18,person woman man youre fired trump elections2020,533814096.0,40.2253569,-82.6881395,,United States of America,Ohio,OH,Unemployment,0.6692221760749817,Weakly Supports
1.3243255823567544e+18,trump youre fired bitch,77080568.0,38.9786401,-76.492786,Annapolis,United States of America,Maryland,MD,Unemployment,0.6075417995452881,Weakly Opposes
1.3243472720632627e+18,unemployment trump trumpsamerica,16716142.0,35.7730076,-86.28200809999998,,United States of America,Tennessee,TN,Unemployment,0.9613561034202576,Strongly Supports
1.3243522347553628e+18,cant you phrase something accurately the current president has not dealt with unemployment and there is no reason to think trump gop republicans will deal with it at all hey why not say 7500 weekly jobless clains have never occurred each week since march,18379569.0,43.157285,-77.615214,Rochester,United States of America,New York,NY,Unemployment,0.9680721163749696,Weakly Supports
1.324364716551086e+18,lderes republicanos se desmarcan de trump y defienden el conteo impactolatino mitchmcconnell marcorubio elecciones2020 trump estadosunidos,84963978.0,40.7127281,-74.0060152,New York,United States of America,New York,NY,Unemployment,0.5047740340232849,Weakly Supports
1.3243671324576563e+18,estrategia de trump de llamar fraude a proceso normal de conteo de votos est siendo repudiada por los propios republicanos de alto perfil cercanos a su propia campaa chris christie y rick santorum se alejan de esta tctica de trump eeuudecide2020,1002220734.0,38.8949924,-77.0365581,Washington,United States of America,District of Columbia,DC,Unemployment,0.4584710001945495,Weakly Supports
1.3243760211986227e+18,2400 dead 20m infected babies dying in cages economy in ruins 30 million unemployed trump looting taxpayers unnecessary trade wars lost decades of alliances ruined national security compromised but trump supporters,22033362.0,32.7762719,-96.7968559,Dallas,United States of America,Texas,TX,Unemployment,0.7988414764404297,Weakly Supports
1.3243771767712768e+18,youre about to be jobless trumpvsbiden trump biden election2020 electionresults2020 battlegroundstate trending electionresults podcasts,1.097245555854635e+18,42.3602534,-71.0582912,Boston,United States of America,Massachusetts,MA,Unemployment,0.7679781913757324,Weakly Supports
1.324387752423686e+18,2300 dead americans and counting it didnt have to be this way thanks for nothing republicans trumpvirus trump gop maga,4132841.0,29.9978185,-83.2221527,,United States of America,Florida,FL,Unemployment,0.4068932831287384,Weakly Supports
1.3243887490364457e+18,thx amp 4 saying its not just about peoples priorities its about those voting 4 trump who doesnt care about themtheir priorities or women lgbtq blacklivesmatter unemployed childreninneed covid19 or anyonething but himself,3199937175.0,43.0349931,-87.92249699999999,Milwaukee,United States of America,Wisconsin,WI,Unemployment,0.5190743207931519,Weakly Opposes
1.3243912209493484e+18,trump has nothing on his schedule today not unlike the past 3 yrs 10 months he plans to do nothing nothing about covid nothing about job loss nothing to help americans feed their families or keep a roof over their heads par for the course to put it in trump terms,21544108.0,39.7392364,-104.9848623,Denver,United States of America,Colorado,CO,Unemployment,0.6705316305160522,Weakly Supports
1.324395998567932e+18,trump youre going down bucko,43930449.0,41.875561600000005,-87.6244212,Chicago,United States of America,Illinois,IL,Unemployment,0.7583016157150269,Weakly Supports
1.324399645259387e+18,la negra fatau benzouda se va en 2021 raro comunicado ella sabe que trump gan,1.3088512747717632e+18,32.7174209,-117.1627714,San Diego,United States of America,California,CA,Unemployment,0.5059440732002258,Weakly Supports
1.3244086946421924e+18,its trump getting fired today,17100498.0,40.0757384,-74.4041622,,United States of America,New Jersey,NJ,Unemployment,0.4518167376518249,Weakly Opposes
1.3244296344322826e+18,just a reminder when donaldtrump doesnt get his way he thinks everything is rigged against him hillaryclinton debate unemployment coronavirus impeachedtrump worstpresidentinhistory facebook instagram twitter pressplay theshaderoom worlsstar viral videooftheday,2948372832.0,39.7683331,-86.1583502,Indianapolis,United States of America,Indiana,IN,Unemployment,0.7374218106269836,Weakly Supports
1.3244453695148073e+18,gettourassouttahere youarefired byetrump youabouttoloseyourjob youlost hittheroadjack election2020 byebitch trumpsucks trump,4920733721.0,33.687438799999995,-80.4363743,,United States of America,South Carolina,SC,Unemployment,0.4736111462116241,Weakly Supports
1.324473534731686e+18,america is lie its always been and fact that this was tight race proves its lie 2500 dead covid19 black people murder by police real unemployment rate 24 8 million people added to poverty in last 8 months under trump white people are an embarrassing,476142669.0,39.9527237,-75.16352619999999,Philadelphia,United States of America,Pennsylvania,PA,Unemployment,0.6453314423561096,Weakly Supports
1.3244844481262264e+18,even a dog can sue bad position to be in buddy keep whining like your boy trump and keep suing you about to lose your job,15698910.0,40.7127281,-74.0060152,New York,United States of America,New York,NY,Unemployment,0.6132962107658386,Weakly Supports
1.3244850926312202e+18,ha ha ha espn is laying off hundreds of workers good you hired jamele hill and let the place turn into a divisive political operation nba ratings down 60 it is only the beginning merry christmas to all of the newly unemployed disney leftisthahahah espn trump,2516720598.0,37.7790262,-122.4199061,San Francisco,United States of America,California,CA,Unemployment,0.779242217540741,Weakly Supports
1.3244868565625856e+18,2300 dead americans and counting it didnt have to be this way thanks for nothing republicans trumpvirus trump gop maga,4132841.0,29.9978185,-83.2221527,,United States of America,Florida,FL,Unemployment,0.4068932831287384,Weakly Supports
1.324492629187416e+18,trump votersuppressionisreal,7.809578954164265e+17,31.8160381,-99.5120986,,United States of America,Texas,TX,Unemployment,0.4037234783172607,Weakly Supports
1.3244930371254395e+18,el juez de la crisis electoral del 20 pide unificar normas y evitar traumas impactolatino politica elecciones2020 estadosunidos joebiden trump robertrosenberg,84963978.0,40.7127281,-74.0060152,New York,United States of America,New York,NY,Unemployment,0.4087854027748108,Weakly Supports
1.3244939886746337e+18,neoyorquinos siguen los resultados de la eleccin elecciones2020 biden trump,44488446.0,40.7127281,-74.0060152,New York,United States of America,New York,NY,Unemployment,0.5695318579673767,Weakly Supports
1.3244963134179123e+18,trump apprentice your fired goodbye,37539972.0,36.8529841,-75.9774183,Virginia Beach,United States of America,Virginia,VA,Unemployment,0.6336331367492676,Weakly Supports
1.3244999725329162e+18,empate entre biden y trump las posibilidades de que ocurra y sus soluciones impactolatino politica elecciones2020 joebiden trump estadosunidos,84963978.0,40.7127281,-74.0060152,New York,United States of America,New York,NY,Unemployment,0.4280346930027008,Weakly Supports
1.3245042672988447e+18,donaldtrump your fired leave gracefully sincerely from detroit,71903953.0,42.4733689,-83.2218731,,United States of America,Michigan,MI,Unemployment,0.566200315952301,Weakly Opposes
1.3245057931615314e+18,youre fucking fired trump,7.67533567811416e+17,40.6701033,-73.9859723,New York,United States of America,New York,NY,Unemployment,0.5079094171524048,Weakly Supports
1.324505928855597e+18,4 years of attacks from every angle all found untrue gives peace to the middle east lowers taxes strips regulations for small businesses fixes the plow horse economygdp protects our country largest gain in minority votes lowest unemployment trades deals galore trump,259581493.0,33.749098700000005,-84.39018490000001,Atlanta,United States of America,Georgia,GA,Unemployment,0.4974516630172729,Strongly Supports
1.3245142284395684e+18,campaa de trump pide parar el conteo en pensilvania y logra pequeo triunfo impactolatino elecciones2020 trump estadosunidos pensilvania,84963978.0,40.7127281,-74.0060152,New York,United States of America,New York,NY,Unemployment,0.5450338125228882,Weakly Opposes
1.3245156224080404e+18,we are in the middle of a pandemic thousands are dying every week massive unemployment we cannot allow this until january trump must be removed as unfit and pence can hold shit together until real adults arrive,8.157533898963067e+17,40.9699889,-77.72788309999999,,United States of America,Pennsylvania,PA,Unemployment,0.8251990079879761,Weakly Supports
1.3245157994119045e+18,trump your embarrassing display tonight is exactly why the pandemic is out of control record unemployment civil unrest the sluggish economy and so many covid 19 deaths america needs a better person like joe trump bidenharris2020 america,1.2969754976295117e+18,40.9699889,-77.72788309999999,,United States of America,Pennsylvania,PA,Unemployment,0.7280246615409851,Weakly Opposes
1.3245411194561454e+18,trumpmeltdown trump maga gop youre fired,7.255864482215076e+17,36.7014631,-118.7559974,,United States of America,California,CA,Unemployment,0.4442555010318756,Weakly Supports
1.324541201064751e+18,trumpmeltdown trump maga gop youre fired,7.255864482215076e+17,36.7014631,-118.7559974,,United States of America,California,CA,Unemployment,0.4442555010318756,Weakly Supports
1.3245412628216136e+18,trumpmeltdown trump maga gop youre fired,7.255864482215076e+17,36.7014631,-118.7559974,,United States of America,California,CA,Unemployment,0.4442542195320129,Weakly Supports
1.3245413857189192e+18,trumpmeltdown trump maga gop youre fired,7.255864482215076e+17,36.7014631,-118.7559974,,United States of America,California,CA,Unemployment,0.4442555010318756,Weakly Supports
1.324541478194983e+18,trumpmeltdown trump maga gop youre fired,7.255864482215076e+17,36.7014631,-118.7559974,,United States of America,California,CA,Unemployment,0.4442551136016845,Weakly Supports
1.3245415103358853e+18,trumpmeltdown trump maga gop youre fired,7.255864482215076e+17,36.7014631,-118.7559974,,United States of America,California,CA,Unemployment,0.4442552626132965,Weakly Supports
1.324541911248511e+18,trumpmeltdown trump maga gop youre fired,7.255864482215076e+17,36.7014631,-118.7559974,,United States of America,California,CA,Unemployment,0.4442555010318756,Weakly Supports
1.3245421134768005e+18,trumpmeltdown trump maga gop youre fired,7.255864482215076e+17,36.7014631,-118.7559974,,United States of America,California,CA,Unemployment,0.4442555010318756,Weakly Supports
