tweet_id,clean_tweet,user_id,lat,long,city,country,state,state_code,political_label,label_score,stance
1.3178993090739692e+18,this hits home while trump dances awkwardly businesses are failing we laid off some of our best staff permanently on friday on the same day trump held a super spreader rally the solutions are hard but doable with leadership biden,9.182028035703604e+17,47.6038321,-122.3300624,Seattle,United States of America,Washington,WA,Unemployment,0.5363504886627197,Weakly Opposes
1.317931405704368e+18,killed 2180 americans and counting destroyed the economy amp has 79 unemployment rate destroyed 2 centuries of respect for america in just 3 years so unlike a washed up bc rated actress ill vote for joebiden there you have it kirstie there you have it,4657468409.0,40.2253569,-82.6881395,,United States of America,Ohio,OH,Unemployment,0.8670245409011841,Weakly Supports
1.317954597223338e+18,saw ad where joebiden said he has a plan to increase jobs by 5 million why didnt he tell presidentobama his secret plan 12 years ago and do it then,205752286.0,35.7803977,-78.63909890000001,Raleigh,United States of America,North Carolina,NC,Unemployment,0.4829577505588531,Weakly Supports
1.3179547028357898e+18,it never ends yes thats how most of us have felt the last 4 years biden,14622892.0,34.0536909,-118.242766,Los Angeles,United States of America,California,CA,Unemployment,0.4394893646240234,Weakly Supports
1.3179639598744535e+18,this is least important problem in the us theres ppl dying from a pandemic millions unemployedfacing evictionstarvation and ure here worried about a fcuking embassy most of us will never visit you fcuks gave us 1200 bucks were all poorer except the 1 fcuk you biden,1.2396718168444887e+18,32.182598,-95.7893178,,United States of America,Texas,TX,Unemployment,0.7616853713989258,Weakly Opposes
1.3180102701706486e+18,nearly 2200 dead 10 dying each day 670 new cases daily 37 million unemployed if only donald trump did the right thing and stayed consistent and protected america like he protected roger stone this would not be america today on trumps watch vote biden,7.036466044866396e+17,40.7127281,-74.0060152,New York,United States of America,New York,NY,Unemployment,0.6116637587547302,Weakly Supports
1.3181298510442988e+18,gojoe joebiden biden bidenunitesus,111503313.0,26.5781179,-98.13973,,United States of America,Texas,TX,Unemployment,0.4652711451053619,Weakly Opposes
1.3181656373746156e+18,trump doesnt care about you and he lies a lot biden jobs ohio,898681729.0,42.3602534,-71.0582912,Boston,United States of America,Massachusetts,MA,Unemployment,0.6066930890083313,Weakly Supports
1.3181744945660764e+18,this is the reason theyre bashing amp lying about joebidenthe wealthy will pay more,8.90653225430528e+17,27.7567667,-81.4639835,,United States of America,Florida,FL,Unemployment,0.4878768026828766,Weakly Supports
1.3182154771313828e+18,terrorismo electoral si biden y los demcratas ganan dmc podra verse obligada a iniciar despidos permanentes a partir de fines de 2020 yo principios de 2021 george daniels president de daniels manufacturing corporation dmc en orlando florida a sus empleados,37769853.0,25.7741728,-80.19362,Miami,United States of America,Florida,FL,Unemployment,0.5713534355163574,Weakly Supports
1.3182542964676895e+18,meanwhile in americawhen was the last time the us did any sort of worldrenowned infrastructure project it would be a great way to help jobless working class americans right now but nah biden will not fundamentally change anything,1069133311.0,43.0349931,-87.92249699999999,Milwaukee,United States of America,Wisconsin,WI,Unemployment,0.843101978302002,Weakly Supports
1.318266396246184e+18,the truth is already out on president trump over 8 million americans infected amp 2180 dead from covid more americans unemployed than during the great depression a deficit over 3 trillion dollars a broken economy how much more of president trump can america take biden,8.888136709851054e+17,34.395342,-111.7632755,,United States of America,Arizona,AZ,Unemployment,0.7401769161224365,Weakly Supports
1.3182726006870098e+18,just in breaking florida manufacturing company warned employees of layoffs if biden wins breakingnews,1.201800572988473e+18,64.44596130000001,-149.680909,,United States of America,Alaska,AK,Unemployment,0.4696643054485321,Weakly Supports
1.31827398377148e+18,florida company warned employees of layoffs if biden wins thehill,3362914971.0,32.701939,-97.1056238,Arlington,United States of America,Texas,TX,Unemployment,0.4995411336421966,Weakly Supports
1.3182800416299295e+18,these will be the longest 14 days of joebiden s basement life,55970568.0,37.9747645,-87.5558483,Evansville,United States of America,Indiana,IN,Unemployment,0.4564149379730224,Weakly Supports
1.3182800945033912e+18,these will be the longest 14 days of joebiden s basement life,55970568.0,37.9747645,-87.5558483,Evansville,United States of America,Indiana,IN,Unemployment,0.4564172029495239,Weakly Supports
1.3183014238058455e+18,most biden voters dont have jobs so you literally have nothing else to do all day just go vote and stop talking about it come up with a winning at life plan instead,8.888894688240271e+17,40.9699889,-77.72788309999999,,United States of America,Pennsylvania,PA,Unemployment,0.4425072371959686,Weakly Supports
1.3183149172969595e+18,surprise surprise over 8 million americans infected amp 2180 dead from covid more americans unemployed than during the great depression a deficit over 3 trillion dollars a broken economy and senator rubio and his gop friends want to do nothing what a surprise biden,8.888136709851054e+17,34.395342,-111.7632755,,United States of America,Arizona,AZ,Unemployment,0.7825114130973816,Weakly Supports
1.318317284813951e+18,look at black unemployment rates under trump before covid19 it was joe biden that wrote the law incarcerating more black males joebiden youaintblack,23531111.0,32.7762719,-96.7968559,Dallas,United States of America,Texas,TX,Unemployment,0.8361157774925232,Weakly Supports
1.3183458485946163e+18,if you check the facts was handed a strong economy a decreasing unemployment rate of 35 thanks to biden trump will be the first president to leave office with a negative employment number and debt crisis that may never be overcome,1.1559431080115937e+18,26.0112014,-80.1494901,,United States of America,Florida,FL,Unemployment,0.8759257197380066,Weakly Supports
1.3183612098596782e+18,stimuluspackage now or we flip on you you will have single handedly list the election for biden and congress by being vindictive amp greedy you dont care about the people that is very evident caunemployment voteoutnancypelosi unemployment,7.055924865179812e+17,27.7567667,-81.4639835,,United States of America,Florida,FL,Unemployment,0.9197872877120972,Weakly Opposes
1.318384767444734e+18,joebiden in the whitehouse nationwide lockdown increased unemployment number of citizens reliant on the government tax increases goodbye middleclass socialism wakeupamerica walkaway blexit trump2020tosaveamerica,2542311260.0,36.7014631,-118.7559974,,United States of America,California,CA,Unemployment,0.4729091823101043,Weakly Supports
1.3184019956576952e+18,i am currently unemployed because of your reaction to the virus i could wait my 11 year old daughter could be a better president than you vote joebiden,161725715.0,40.0796606,-89.4337288,,United States of America,Illinois,IL,Unemployment,0.8445193767547607,Weakly Supports
1.3184790298679583e+18,the coronavirus is the worse pandemic since 1918 why is trump doing to slow down the spread nothing we see the results of trumps of incompetence a wrecked economy millions of people unemployed and people waiting in food lines vote biden,4739729796.0,37.7790262,-122.4199061,San Francisco,United States of America,California,CA,Unemployment,0.5806935429573059,Weakly Supports
1.318538060821336e+18,trump trade war failure farm bankruptcies and factory closings biden ohio pennsylvania,898681729.0,42.3602534,-71.0582912,Boston,United States of America,Massachusetts,MA,Unemployment,0.4432369172573089,Weakly Supports
1.3185425544098324e+18,this letter is to serve as a public legal notice that americans will be terminating your employment effective 11320 biden americaortrump byedon2020,9.722801980820808e+17,36.7014631,-118.7559974,,United States of America,California,CA,Unemployment,0.5334435105323792,Weakly Supports
1.318569372089258e+18,yeaahj riigghhtt because of youre stuuppiiddttyy millions are unemployed vote joe biden 2021,182957444.0,32.831563,-96.8007733,,United States of America,Texas,TX,Unemployment,0.6909212470054626,Weakly Supports
1.318595458999214e+18,oh chuck no stimulus for all these families suffering bad news for ur party sending this 2every person i know you heartless evil man thanksgiving thanks shopping hunterbidenemails joebiden political trump will make it big after his reelection 4 all,2738791312.0,40.9699889,-77.72788309999999,,United States of America,Pennsylvania,PA,Unemployment,0.4711482226848602,Weakly Supports
1.318615143454929e+18,unite biden,1.1507899813606236e+18,38.8949924,-77.0365581,Washington,United States of America,District of Columbia,DC,Unemployment,0.4885253012180328,Strongly Supports
1.318637921226797e+18,youre fired biden,4057276633.0,36.1672559,-115.1485163,Las Vegas,United States of America,Nevada,NV,Unemployment,0.7405065894126892,Weakly Opposes
1.3186409997788242e+18,today keto doctor eric berg is talking about keto not working hm foxnews declines a story about joebidens son hunterbiden because its the same bullshit as keto,8.975333883069522e+17,38.8949924,-77.0365581,Washington,United States of America,District of Columbia,DC,Unemployment,0.423714131116867,Weakly Supports
1.318700747979133e+18,websters disctionary an empty suit joebiden,8.3780836551023e+17,38.8949924,-77.0365581,Washington,United States of America,District of Columbia,DC,Unemployment,0.622817873954773,Weakly Supports
1.318700873363673e+18,i oppose the joebiden depression,1.2628939966295695e+18,33.4255056,-111.9400125,Tempe,United States of America,Arizona,AZ,Unemployment,0.5528771281242371,Weakly Supports
1.318701362855686e+18,cnn doj story just broke laptop real emails real no russian disinformation how long has fbi christopherwray had laptop wrey youre fired do ur job barr biden maga,4285046352.0,31.8160381,-99.5120986,,United States of America,Texas,TX,Unemployment,0.6273477077484131,Weakly Supports
1.318761520898007e+18,its cute when they talk about biden lying hilarious nice try losing,900435156.0,45.63069539999999,-122.6744557,Vancouver,United States of America,Washington,WA,Unemployment,0.4049614667892456,Weakly Supports
1.3188832326671278e+18,employees were in demand with low unemployment amp able to ask for more everyone had pep in their step get the word out use your platform biden kamalaharris will tank economy trump2020 walkaway,1.3009846911269478e+18,35.7730076,-86.28200809999998,,United States of America,Tennessee,TN,Unemployment,0.6947806477546692,Strongly Supports
1.318972592255062e+18,weird tales from joebidens basement a harrowing tale of survival for one young oversniffed sex slave,1.0279452733042648e+18,34.14764520000001,-118.1444779,Pasadena,United States of America,California,CA,Unemployment,0.4209766983985901,Weakly Supports
1.318975458537595e+18,my 401k tripled under biden crashed our great american economy 30 million americans are unemployed lowest gdp growth in history 1st president in history tonleave office with negative jobs growth bidenharrislandslide2020,7.457431241026765e+17,32.7762719,-96.7968559,Dallas,United States of America,Texas,TX,Unemployment,0.8522495031356812,Weakly Supports
1.3189974935106642e+18,in the donothing gop senates america over 8 million americans are infected amp 2190 are dead from covid more americans are unemployed than during the great depression the deficit is over 3 trillion a broken economy is ignored sen mcconnell america needs help biden,8.888136709851054e+17,34.395342,-111.7632755,,United States of America,Arizona,AZ,Unemployment,0.5657796859741211,Weakly Supports
1.3190077559408271e+18,you damn rightlittle marcowhen democrats win the w housethe senate and congresshopefully you will be out of a jobbiden harris,1.0384628956197478e+18,33.2588817,-86.8295337,,United States of America,Alabama,AL,Unemployment,0.5587341785430908,Weakly Supports
1.319009634942935e+18,this is illegal company danielsmanufacturingcompany dmc georgedaniels threatens employees that if they vote for biden theyll guarantee permanent layoffs at the end of 2020 2021 orlando,8.530381299845366e+17,33.857328,-84.0199108,,United States of America,Georgia,GA,Unemployment,0.727817714214325,Weakly Opposes
1.3190165895099556e+18,72 backed a 2 trillion stimulus pkg house dems have had approved since may to extend increased unemployment insurance send stimulus checks to most americans amp provide financial support to statelocal governments biden voters prefer biden over trump,1.2386856990476e+18,27.7567667,-81.4639835,,United States of America,Florida,FL,Unemployment,0.7092641592025757,Strongly Supports
1.3190207002634363e+18,lets see during the 8 years of obama and biden the unitedstates cake out of the bush era crisis to a blooming economy all years unemployment went down wallstreet went up every year where in gods name do you suppose now will be different,2933782246.0,28.5421109,-81.3790304,Orlando,United States of America,Florida,FL,Unemployment,0.9050382375717164,Weakly Opposes
1.3190495390770668e+18,recomendado ver la cara oculta de joebiden joebidenisaracist,8.830531402113147e+17,37.7790262,-122.4199061,San Francisco,United States of America,California,CA,Unemployment,0.5422950983047485,Weakly Opposes
1.319091209147736e+18,un brings china surveillance to next level hunter bidens role in china chinainfocus via,8.971172598350807e+17,34.2331373,-102.4107493,,United States of America,Texas,TX,Unemployment,0.4738247692584991,Weakly Supports
1.3190916226809446e+18,millions out of work more than 2200 dead from covid19 and cities in shambles from rioting yup joe biden never got any of that accomplished congrats,28922674.0,44.4308975,-89.6884637,,United States of America,Wisconsin,WI,Unemployment,0.6151643991470337,Weakly Supports
1.3192414314464092e+18,wallstreet during obama biden record growth you inherited a blooming economy unemployment was going down significantly blooming economy without the fed buying bonds americaortrump,2933782246.0,28.5421109,-81.3790304,Orlando,United States of America,Florida,FL,Unemployment,0.8215776085853577,Weakly Supports
1.3192496317174374e+18,depression trumps total incompetence and botched handling of covid19 has us economy in trumprecession vote biden,27282113.0,43.9792797,-120.737257,,United States of America,Oregon,OR,Unemployment,0.4257733821868896,Weakly Supports
1.3192536090166272e+18,nailedit biden is like the nba and doesnt want to threaten the money pot,1.2671565575502356e+18,34.0536909,-118.242766,Los Angeles,United States of America,California,CA,Unemployment,0.4366455078125,Weakly Supports
1.319266395218129e+18,hunter biz partner confirms email details joe bidens push to make millions from china nhpolitics maildetailsjoebidenspushtomakemillionsfromchinautmsourcetwittersitebuttonsamputmmediumsite20buttonsamputmcampaignsite20buttons via,1.2117051237196308e+18,43.4849133,-71.6553992,,United States of America,New Hampshire,NH,Unemployment,0.4341354966163635,Weakly Supports
1.3192908316441928e+18,there is a whole world out there not on twitter or social media platforms trying to survive a pandemic joblessness hunger police brutality we are super engaged here but please reach out to those you know who havent been following the election empower them to vote biden,2876041031.0,40.7127281,-74.0060152,New York,United States of America,New York,NY,Unemployment,0.620543360710144,Weakly Supports
1.31929958590319e+18,um no they dont biden,4647392234.0,36.7014631,-118.7559974,,United States of America,California,CA,Unemployment,0.5411261916160583,Neutral
1.3193196120397578e+18,you cant be serious given your boy has you pegged enjoy continuing to rail against biden for the next several years,16691663.0,41.875561600000005,-87.6244212,Chicago,United States of America,Illinois,IL,Unemployment,0.5664737820625305,Weakly Supports
1.3193207964105564e+18,americaisanidea wehaveneverliveduptoit joebiden is a joke,529556135.0,44.9772995,-93.2654692,Minneapolis,United States of America,Minnesota,MN,Unemployment,0.7693465948104858,Weakly Supports
1.3193398674285773e+18,joe please be prepared to respond to trump tonight ws economy his rallies covid deaths unemployment ppl of color be prepared joebiden joebidenkamalaharris2020 joebiden2020,1024629668.0,40.0757384,-74.4041622,,United States of America,New Jersey,NJ,Unemployment,0.8797411322593689,Weakly Supports
1.3193897448292557e+18,heres how many manufacturing jobs weve lost since obama took office obama and joe biden,3390324809.0,27.7567667,-81.4639835,,United States of America,Florida,FL,Unemployment,0.5511116981506348,Weakly Supports
1.3193915562442465e+18,obama economy thousands of americans losing their jobs as factories shutter move to mexico via obama and joe biden,3390324809.0,27.7567667,-81.4639835,,United States of America,Florida,FL,Unemployment,0.7385133504867554,Weakly Supports
1.3194203562943035e+18,joebiden dropoutjoe,447490172.0,42.3602534,-71.0582912,Boston,United States of America,Massachusetts,MA,Unemployment,0.7336764335632324,Weakly Supports
1.3194260185291694e+18,berniesanders looking to be joebidens labor secretary,1.146493332182487e+18,40.7127281,-74.0060152,New York,United States of America,New York,NY,Unemployment,0.5086954832077026,Strongly Supports
1.3194394382717952e+18,yes americans have realized all that trumps virus has done20 americans dead 27 million jobless economy destroyed amp yes joebidens polling s are getting larger by the day wheres the relief bill for suffering americans while you golf every weekend at 2500 a pop,9.965851493441084e+17,34.395342,-111.7632755,,United States of America,Arizona,AZ,Unemployment,0.5627937316894531,Weakly Supports
1.3194473511703552e+18,lock yourself in the basement wth is trump talking about ppl are dying amp have no jobs debates2020 biden,2812318155.0,39.5162234,-76.9382069,,United States of America,Maryland,MD,Unemployment,0.8206443190574646,Weakly Supports
1.3194520286749e+18,this is the first time most of the country has heard about joebidens scandal debates2020,2652620492.0,44.4308975,-89.6884637,,United States of America,Wisconsin,WI,Unemployment,0.4293450117111206,Weakly Supports
1.3194533508580024e+18,presidentialdebate2020 trump is so petty why he gotta talk about biden son not having a job low blows,9.146541896236687e+17,43.6211955,-84.6824346,,United States of America,Michigan,MI,Unemployment,0.6673840880393982,Weakly Supports
1.3194562569234555e+18,jobs gone biden,19264136.0,40.4416941,-79.99008609999998,Pittsburgh,United States of America,Pennsylvania,PA,Unemployment,0.7600500583648682,Weakly Supports
1.3194581546110523e+18,think biden is imploding,244882007.0,42.3315509,-83.04664029999999,Detroit,United States of America,Michigan,MI,Unemployment,0.4515627920627594,Weakly Supports
1.31945868849988e+18,booming biden doesnt know the economy is the heart of its drives our national security 12 million unemployed are suffering because of the political blockades economic by bidenharris maga,7.22085049806422e+17,29.7028266,-98.1257348,New Braunfels,United States of America,Texas,TX,Unemployment,0.7690762281417847,Weakly Supports
1.3194588674960302e+18,unfortunately biden has also lost his calm,6633712.0,26.640628000000003,-81.87230840000001,Fort Myers,United States of America,Florida,FL,Unemployment,0.4110123813152313,Weakly Supports
1.3194619380201267e+18,you and biden can go fly a kite i warned you in march that shutting down the country would have dire consequences we are only seeing the beginning of it suicides unemployment loss of retirements businesses failing your policies are horrible,88919170.0,45.98965870000001,-94.6113288,,United States of America,Minnesota,MN,Unemployment,0.6311177611351013,Weakly Supports
1.3194634270819656e+18,the poor boys biden,491880365.0,31.8160381,-99.5120986,,United States of America,Texas,TX,Unemployment,0.6034817099571228,Weakly Opposes
1.3194638274828288e+18,the poor boys poorboys biden,468129052.0,34.9550817,-97.2684063,,United States of America,Oklahoma,OK,Unemployment,0.6002968549728394,Weakly Supports
1.319464682432942e+18,and poorboys sandwiches biden,3550412652.0,31.8160381,-99.5120986,,United States of America,Texas,TX,Unemployment,0.4157899618148803,Weakly Supports
1.3194649829213143e+18,unemployed americans due to covid arent concerned how dirty china is covid19 biden,29194420.0,41.875561600000005,-87.6244212,Chicago,United States of America,Illinois,IL,Unemployment,0.9363433718681335,Weakly Opposes
1.3194657068833505e+18,wonder if joebiden knows democrats dont create jobs they create dependency debates2020,529556135.0,44.9772995,-93.2654692,Minneapolis,United States of America,Minnesota,MN,Unemployment,0.4636764526367187,Weakly Supports
1.3194663603557458e+18,bullshit joe cant hang get a real job joe youre about to get fired debates2020 debate debate2020 joebiden kamalaharris kamalaharris democrats,50960896.0,36.17497,-115.13722,,United States of America,Nevada,NV,Unemployment,0.6931686997413635,Weakly Opposes
1.3194670587494277e+18,really joebiden why are we shutting down the oil industry again thats you pitch to america put people out of work,2652620492.0,44.4308975,-89.6884637,,United States of America,Wisconsin,WI,Unemployment,0.4060509204864502,Weakly Supports
1.319467999212925e+18,and you havent been getting it for the past 4 years biden,4863159871.0,36.7014631,-118.7559974,,United States of America,California,CA,Unemployment,0.4680248200893402,Weakly Supports
1.3194704763646405e+18,nope biden,2323147022.0,38.8949924,-77.0365581,Washington,United States of America,District of Columbia,DC,Unemployment,0.630155622959137,Neutral
1.3194707530797916e+18,nope not a great line of attack biden sucks and destroys jobs is better,1.0472211957609636e+18,32.7762719,-96.7968559,Dallas,United States of America,Texas,TX,Unemployment,0.5392436385154724,Weakly Opposes
1.3194713963182285e+18,poor joe biden,7892912.0,31.8160381,-99.5120986,,United States of America,Texas,TX,Unemployment,0.4865781962871551,Weakly Supports
1.3194719853873605e+18,joebiden said it he will do away with oil remember that philadelphia ohio texas you be on unemployment soon,447263886.0,39.9527237,-75.16352619999999,Philadelphia,United States of America,Pennsylvania,PA,Unemployment,0.5134077668190002,Weakly Supports
1.3194750211488768e+18,so burisma hired hunter biden out of charity for a random unemployed us drug addict thats the official npr line how naive are you or have you pledged as a party hack blind loyalty to the democratic party or are you scared or a careerist looking for a government job,14066868.0,34.0536909,-118.242766,Los Angeles,United States of America,California,CA,Unemployment,0.5961856245994568,Weakly Opposes
1.3194914047254446e+18,proud boys name when biden is potus poor boys,1897239480.0,44.5990718,-72.5002608,,United States of America,Vermont,VT,Unemployment,0.4389784038066864,Weakly Opposes
1.3195301178074604e+18,i hate biden sorry so weak,569701065.0,40.7127281,-74.0060152,New York,United States of America,New York,NY,Unemployment,0.4608263373374939,Weakly Supports
1.3195355119422628e+18,obama fails miserably to help joebidens sinking campaign in pennsylvan via,22468101.0,36.7014631,-118.7559974,,United States of America,California,CA,Unemployment,0.5606832504272461,Weakly Supports
1.319585835478618e+18,american jobs jobseeker joebiden unemployment rate would skyrocket,9.931786216689376e+17,34.9550817,-97.2684063,,United States of America,Oklahoma,OK,Unemployment,0.8815367817878723,Weakly Supports
1.319617028827861e+18,hey joebiden can you and your son hunterbiden do an interview to clear up the laptop amp email issue that way we can assess your true character on the ballot 11daysuntilelection,2841348657.0,36.1622296,-86.7743531,Nashville,United States of America,Tennessee,TN,Unemployment,0.4302266240119934,Weakly Supports
1.3196362936183808e+18,8 million more people just crash landed into poverty as a direct result of donald jackazz trump and clueless repunklicansim beginning to think you all dont have clue what economy means votebluetoendthisnightmare biden trumpchinabankaccount bidencares gaetzwontdebate,1.1987690233134203e+18,27.7567667,-81.4639835,,United States of America,Florida,FL,Unemployment,0.4311875104904175,Weakly Supports
1.3196505784405934e+18,then joe can permanently remain in the basement biden,1.3145757920688456e+18,45.709097,-68.8590201,,United States of America,Maine,ME,Unemployment,0.6576390862464905,Weakly Supports
1.3196584952521523e+18,start saving your pennies and store up the food cuz joebiden is going to end your jobs nomoreoil4joe,29921733.0,34.395342,-111.7632755,,United States of America,Arizona,AZ,Unemployment,0.6652321219444275,Weakly Supports
1.3196587755828224e+18,unfollowing because biden says youre racist,312995926.0,34.395342,-111.7632755,,United States of America,Arizona,AZ,Unemployment,0.5531141757965088,Weakly Opposes
1.3196716043689247e+18,rescued economy u mean trump trashed a rescued economy built by obamabiden rising wages u mean skyrocketing unemployment peace deals u mean ignoring slaughtered journalists bounties on our soldiers continued foreign interference amp alienating our allies,267988131.0,43.9792797,-120.737257,,United States of America,Oregon,OR,Unemployment,0.6503965258598328,Weakly Supports
1.3196838263277036e+18,down goes joebiden youve lost and you know it,75077990.0,33.9414549,-84.4147176,,United States of America,Georgia,GA,Unemployment,0.5654115080833435,Weakly Supports
