tweet_id,clean_tweet,user_id,lat,long,city,country,state,state_code,political_label,label_score,stance
1.319183681714557e+18,lesen sie hier mein interview zu den us wahlen und den daraus resultierenden herausforderungen fr deutschland gefhrt von der referentenagentur bertelsmann im geprch mit usaexpertin sandra navidi trump biden wirtschaft business brse,29105288.0,40.7127281,-74.0060152,New York,United States of America,New York,NY,Welfare,0.7799264192581177,Neutral
1.3193011521445806e+18,thaatsright trump thecomebackkid,127272637.0,37.1677128,-94.8464256,,United States of America,Kansas,KS,Welfare,0.838832676410675,Neutral
1.319303336705708e+18,mitchisnotwell moscowmitch is like everyone trump has under his spell they rot from the inside out mitch falls all over himself to give corporations tax breaks amp subsidies welfare but when real people need help he clutches the gov purse so tight his hands turn black,120156455.0,43.6447642,-114.0154071,,United States of America,Idaho,ID,Welfare,0.5611388683319092,Weakly Supports
1.3193656343970324e+18,wh staffers reveal to wapo why trump stormedout of lesleystahl interview she just had a tone he didnt like saying trump overreacted amp that his lashing out will likely only serve to increase the shows ratings,1956754434.0,25.9812025,-80.148379,,United States of America,Florida,FL,Welfare,0.4133729040622711,Neutral
1.3194092163359662e+18,woacan someone do a socially distanced wellness check on the absolutely badass journalists at the make sure they are eating and sleeping cause the spillage is thursdaythoughts 2020debate vote elections2020 trumpmeltdown trump,1.311902198410875e+18,34.0536909,-118.242766,Los Angeles,United States of America,California,CA,Welfare,0.5500458478927612,Neutral
1.31942345973112e+18,thejimmydoreshow why the republicans will lose moscowmitch stimulus foodbanks evictioncrisis wallstreet corporateamerica donors trump,1.1867536400082125e+18,33.5206824,-86.80243259999999,Birmingham,United States of America,Alabama,AL,Welfare,0.5182193517684937,Neutral
1.319453755369083e+18,welker is letting trump run long but being strict to biden this shit again debates2020,59700745.0,32.7349196,-117.1545974,San Diego,United States of America,California,CA,Welfare,0.4801142811775207,Neutral
1.319456999323566e+18,welker has zero control over trump maddening,121199833.0,36.7014631,-118.7559974,,United States of America,California,CA,Welfare,0.7788737416267395,Weakly Supports
1.319457272196551e+18,welker has not told biden once you have 30 seconds trump,20292060.0,36.7014631,-118.7559974,,United States of America,California,CA,Welfare,0.4006958603858948,Neutral
1.3194586082880266e+18,now trumps quoting the doefund wilingreadyable hoping people are charitable to him after he serves time for his crimesagainsthumanity,26616813.0,40.7127281,-74.0060152,New York,United States of America,New York,NY,Welfare,0.5455780625343323,Neutral
1.3194597482661435e+18,they are so well taken care of trump debatetonight,22173073.0,34.0536909,-118.242766,Los Angeles,United States of America,California,CA,Welfare,0.5167025923728943,Neutral
1.3194597835613143e+18,they are so well taken care of trump on children separated from parents at the border with mexico,122396513.0,38.8949924,-77.0365581,Washington,United States of America,District of Columbia,DC,Welfare,0.5466249585151672,Weakly Supports
1.3194598226984182e+18,theyre so well taken care of has trump seen this familyseparating cells and camps debates2020,17888787.0,42.622089,-77.42848409999999,,United States of America,New York,NY,Welfare,0.5306047797203064,Neutral
1.3194600726200525e+18,they are so well taken care of trump debates2020,24962387.0,34.0536909,-118.242766,Los Angeles,United States of America,California,CA,Welfare,0.4793804585933685,Neutral
1.3194600832779796e+18,sure those kids dont have parents but theyre so well cared for wow trump just doesnt get it,2569415413.0,41.5051613,-81.6934446,Cleveland,United States of America,Ohio,OH,Welfare,0.5243086218833923,Weakly Supports
1.319460192023609e+18,trump they were so well care for childrenincages 500 lost children,1283648881.0,41.481993200000005,-81.7981908,,United States of America,Ohio,OH,Welfare,0.4473729729652405,Weakly Supports
1.319460428234117e+18,trump confirmed it was 28 billion given in welfare to the starving us farmers because of the trade war he created with china great job trump the art of the deal not,74670021.0,36.7014631,-118.7559974,,United States of America,California,CA,Welfare,0.6412604451179504,Neutral
1.3194606859952497e+18,trump those orphans we created they are in such clean facilities,1449591198.0,38.6264178,-90.1998378,St. Louis,United States of America,Missouri,MO,Welfare,0.4074476659297943,Weakly Supports
1.3194614023529103e+18,joebiden said all blacks are on food stamps how is trump racist,2889180794.0,38.7183422,-95.0816354,,United States of America,Kansas,KS,Welfare,0.7315383553504944,Weakly Supports
1.319461401501573e+18,trump orphaned over 550 children and he doesnt care,499073990.0,40.7127281,-74.0060152,New York,United States of America,New York,NY,Welfare,0.4278230369091034,Weakly Supports
1.3194630798103716e+18,the kids trump stole from their parents are so well taken care of,1.0396083176585912e+18,38.7251776,-105.6077167,,United States of America,Colorado,CO,Welfare,0.637973427772522,Weakly Supports
1.319464141229232e+18,the trump used car salesman is running roughshod over the kind and thoughtful car buyer im sorry to watch this happen but once an aggressive opinionated bully always one trump biden,482696786.0,30.8703881,-92.007126,,United States of America,Louisiana,LA,Welfare,0.4072549045085907,Weakly Supports
1.319466208392061e+18,trump expresses concern for the safety of birds,14962779.0,38.8949924,-77.0365581,Washington,United States of America,District of Columbia,DC,Welfare,0.7571793794631958,Neutral
1.3194680671187763e+18,trump loves elderly people so much he cut funding on meals on wheels 2 years ago trumpmeltdown,1.2820788258709627e+18,32.7174209,-117.1627714,San Diego,United States of America,California,CA,Welfare,0.4382017254829407,Weakly Supports
1.3194733902694646e+18,my skin crawls everytime trump calls president obama obama the disrespect is outrageous trumpispathetic trumpisnotwell trumpwilose bidenharris2020,29984411.0,35.6729639,-79.03929190000001,,United States of America,North Carolina,NC,Welfare,0.5376529693603516,Weakly Supports
1.3194869504542966e+18,watch how joe biden gets caught lying to you with body language creepyjoebiden usa voteredtosaveamerica2020 trumpforamerica trump trump2020 maga,22887909.0,41.1035786,-80.6520161,Youngstown,United States of America,Ohio,OH,Welfare,0.440884381532669,Neutral
1.3194945922285115e+18,welker is a biased antitrumper moderator she totally tries to corner trump repeatedly and she tries to move uncomfortable topics away from biden and give him softball avenues to avoid responding on hunterbiden controversies and his failed policies etc,2818208253.0,36.7014631,-118.7559974,,United States of America,California,CA,Welfare,0.5358126163482666,Neutral
1.3196116898729943e+18,godhelpus godsaveamerica debates2020 presidentialdebate presidentialdebates2020 biden trump cnn foxnews election2020,159630144.0,26.1223084,-80.14337859999999,Fort Lauderdale,United States of America,Florida,FL,Welfare,0.4577894508838653,Neutral
1.3196187701980283e+18,trump talking about an animal shelter not one major new outlet is covering this horror,7829912.0,29.949932300000004,-90.0701156,New Orleans,United States of America,Louisiana,LA,Welfare,0.5542718768119812,Weakly Supports
1.3196230678957998e+18,debates2020 why trump failed the usa on covid19,2493013459.0,38.7604815,-92.5617875,,United States of America,Missouri,MO,Welfare,0.5881197452545166,Neutral
1.319632784147796e+18,media better worry about urbanwomen suffering trump is all about helping urbanwomen and their families urbanwomenfortrump,444994317.0,30.8703881,-92.007126,,United States of America,Louisiana,LA,Welfare,0.7070159912109375,Strongly Supports
1.319658379145601e+18,has anyone checked on campaign staff this morning might need a welfare check done crookedjoebiden trump,7.457890827400643e+17,35.0457219,-85.3094883,Chattanooga,United States of America,Tennessee,TN,Welfare,0.7259796261787415,Weakly Supports
1.3196608285017047e+18,covid stocks stocktowatch ny virus mask money build wellness trump talk about this,27441944.0,40.7127281,-74.0060152,New York,United States of America,New York,NY,Welfare,0.6649286150932312,Neutral
1.319701668338991e+18,so many reasons why moms are not voting for trump disrespectful to women poor model for children lazy doesnt do the job lives off the dole but doesnt pay his share 750 not nice to wife narrow view of whos acceptable pillages environment irresponsible,208607949.0,42.3788774,-72.03236600000001,,United States of America,Massachusetts,MA,Welfare,0.4158582985401153,Neutral
1.319731284072108e+18,trump they are so well taken care of,7.615254629632e+17,42.3602534,-71.0582912,Boston,United States of America,Massachusetts,MA,Welfare,0.5231220126152039,Neutral
1.319776736184238e+18,judge strikes down new trump rule cutting off food stamps for 7000 americans trump foodstamps,9.150025235844874e+17,40.7127281,-74.0060152,New York,United States of America,New York,NY,Welfare,0.5836818814277649,Weakly Supports
1.319824320558936e+18,god bless you usa trump,1.2258919909503672e+18,34.0980031,-118.329523,Los Angeles,United States of America,California,CA,Welfare,0.5721161365509033,Strongly Supports
1.3198329049612288e+18,seguro fue culpa de trump,68326713.0,38.8949924,-77.0365581,Washington,United States of America,District of Columbia,DC,Welfare,0.482817679643631,Neutral
1.3201919045169605e+18,this alone should have ended trump that we werent united in condemning this atrocity has forever changed my view of my beloved usa,256672440.0,38.7251776,-105.6077167,,United States of America,Colorado,CO,Welfare,0.4475407302379608,Weakly Supports
1.3203386078408745e+18,trump team ignorance is also a terrible disease that tears at the healthwelfare of the countrytheyve consistently spread the trumpplague via superspreader events ignoring pandemic precautions and continually spreading disinformation bidenharris first step to recovery,208607949.0,42.3788774,-72.03236600000001,,United States of America,Massachusetts,MA,Welfare,0.6552167534828186,Neutral
1.3204051062575145e+18,sundaythoughts sundaymorning sundaywisdom sundaymood sundaymood sundayvibes well i finished 2 chapters of new trump zombie apocalypse novella keep calm and ignore the zombies maybe i still have time for one quick short story too,335096977.0,40.7127281,-74.0060152,New York,United States of America,New York,NY,Welfare,0.5217349529266357,Neutral
1.320441241570521e+18,offset and friend literally drive through police guided trump rally brandishing gun rally attendee hits car with flag and we are then accused of being the aggressors smh beverlyhillsfreedomrally lies cardib iwasthere,1.2428684624073974e+18,36.7014631,-118.7559974,,United States of America,California,CA,Welfare,0.5630189776420593,Neutral
1.3205207173189714e+18,i signed up to for just to watch tonight 60minutes trump onlytimethiswilleverbetweeted,150206230.0,35.0457219,-85.3094883,Chattanooga,United States of America,Tennessee,TN,Welfare,0.4557545483112335,Neutral
1.32075622742127e+18,trump keeps his eye of the dowjones for his buddies but not the welfare of the people its disgusting,3965466920.0,34.0923014,-118.3692894,,United States of America,California,CA,Welfare,0.5079959630966187,Weakly Supports
1.320771595720364e+18,true fck the wealthy subsidies fck the farmers who cant manage their businesses fck the airlines welfareforrich hollywoodelite careerpoliticians rappersfortrump celebritiesfortrump and silverspoon babies like trump,1.0967579145288744e+18,45.709097,-68.8590201,,United States of America,Maine,ME,Welfare,0.7514175176620483,Weakly Supports
1.320779863633105e+18,judge strikes down donaldtrump rule that cuts off food stamps for american families,9.150025235844874e+17,40.7127281,-74.0060152,New York,United States of America,New York,NY,Welfare,0.5128777623176575,Neutral
1.320786461902426e+18,trump cant even protect his whitehouse staff,412474587.0,34.2331373,-102.4107493,,United States of America,Texas,TX,Welfare,0.4146927893161773,Weakly Supports
1.3208131220227113e+18,trump fights in court to block pandemic food aid for lowestincome americans critics say the trump administration is trying to return to its precovid mission of shrinking safety net programstrumpgopcovid19,17674244.0,38.8949924,-77.0365581,Washington,United States of America,District of Columbia,DC,Welfare,0.6880687475204468,Weakly Supports
1.32081343333222e+18,trump fights in court to block pandemic food aid for lowestincome americans omg via,121199833.0,36.7014631,-118.7559974,,United States of America,California,CA,Welfare,0.5253748297691345,Weakly Supports
1.3209267456803348e+18,trump fights in court to block pandemic food aid for lowestincome americans via trumpmeltdown donaldtrump covid19 pandemic,573316665.0,40.7127281,-74.0060152,New York,United States of America,New York,NY,Welfare,0.4401982724666595,Weakly Supports
1.3209296832366756e+18,we were attacked amp trump promised woath to protect amp defend us he told us everyday that he deserved an a grade amp 1010 score as war time president because he handled the invisible enemy perfectly today he said hes tired of hearing about it amp then trumpsurrendered,16483076.0,36.7014631,-118.7559974,,United States of America,California,CA,Welfare,0.4182574152946472,Neutral
1.320952239913984e+18,beautiful usa trump acbconfirmed acb,8.127721463090176e+17,31.7754152,-106.4646348,El Paso,United States of America,Texas,TX,Welfare,0.7276930212974548,Strongly Supports
1.320981591229829e+18,posted thered trump2020 conservative conservativememes funny politics politicalmemes usa draintheswamp trump presidenttrump red redkingdom meme biden bidenharris2020 blm alivesmatter,114923863.0,32.7174209,-117.1627714,San Diego,United States of America,California,CA,Welfare,0.4737045764923095,Neutral
1.320994957256237e+18,vote for usa vote for trump,316214233.0,38.8949924,-77.0365581,Washington,United States of America,District of Columbia,DC,Welfare,0.4663918614387512,Weakly Supports
1.3210738492581192e+18,the trump administration is fighting in federal court to block states from giving billions of dollars in emergency food stamps to the lowestincome americans during the coronavirus crisis,17858736.0,30.2711286,-97.7436995,Austin,United States of America,Texas,TX,Welfare,0.6804823279380798,Weakly Supports
1.3211445318327214e+18,true florida womenseniors against trump,40769714.0,40.7127281,-74.0060152,New York,United States of America,New York,NY,Welfare,0.4057688415050506,Weakly Supports
1.321153154931708e+18,in the middle of a pandemic the trump admin is fighting in federal court to block states from giving billions of dollars in emergency food stamps to the lowestincome americans during the coronavirus crisis pennsylvania california election2020,234133932.0,38.8462236,-77.3063733,,United States of America,Virginia,VA,Welfare,0.505525529384613,Weakly Supports
1.32117417107891e+18,donaldtrump is fighting in federal court to block states from giving billions of dollars in emergency food stamps to lowestincome americans during coronavirus crisis amp swears to protect preexistingconditions believeme,304520563.0,37.7790262,-122.4199061,San Francisco,United States of America,California,CA,Welfare,0.6906932592391968,Weakly Supports
1.3211826332384174e+18,i challenge you lets finish wi the trump virus and lets safe usa and our friends and family,34235958.0,28.5421109,-81.3790304,Orlando,United States of America,Florida,FL,Welfare,0.6445364952087402,Weakly Supports
1.3212129232394035e+18,fdr almost bankrupted this country joebiden if it wasnt for ww ii america would have been broke because of fdrs socialist policies and agenda ohio for trump ohiofortrump,1.119967369521242e+18,40.2253569,-82.6881395,,United States of America,Ohio,OH,Welfare,0.6986080408096313,Neutral
1.321251112322814e+18,look what trump amp cornyn amp in courtgtdenying food assistance to lowest income in a pandemic,1.1069703345893048e+18,32.7762719,-96.7968559,Dallas,United States of America,Texas,TX,Welfare,0.5471462607383728,Weakly Supports
1.3212598733011558e+18,this just in putin cares more about the welfare of his people than trump does of us citizens,469843110.0,27.2939333,-80.35032829999999,Port St. Lucie,United States of America,Florida,FL,Welfare,0.8323665857315063,Neutral
1.3212916618850345e+18,thats the imbecile trumps idea of reminding them what he did for them while humiliating them implying welfare be properly grateful or else,62538319.0,38.1798796,-92.6226454,,United States of America,Missouri,MO,Welfare,0.8941484689712524,Weakly Supports
1.3212991853464986e+18,trump is a fucking asshole who screwed up over and over again with the safety net of his fathers millions but couldnt make the a list at studio 54,15375335.0,41.2021302,-73.3812743,,United States of America,Connecticut,CT,Welfare,0.6830606460571289,Weakly Supports
1.3213244510116372e+18,our wonderful president vote vote vote we need everyone we are the working party not the lazy party votered trump,2738791312.0,40.9699889,-77.72788309999999,,United States of America,Pennsylvania,PA,Welfare,0.4381771385669708,Neutral
1.3213257056621814e+18,these people really need to stop relying on government handouts the rest of us dont get stuck in the middle of nowhere and expect buses to magically appear to bail us out socialists trump,8.913129948855419e+17,38.8949924,-77.0365581,Washington,United States of America,District of Columbia,DC,Welfare,0.5955268740653992,Weakly Opposes
1.3213268761330852e+18,when people rely on government handouts what can they expect seriously its awful and it shows how trump doesnt give a damn about his supporters,8.913129948855419e+17,38.8949924,-77.0365581,Washington,United States of America,District of Columbia,DC,Welfare,0.6308576464653015,Weakly Supports
1.3213416062014917e+18,wethepeopleblametrump,325973597.0,37.7790262,-122.4199061,San Francisco,United States of America,California,CA,Welfare,0.5928633213043213,Neutral
1.3213712615247258e+18,always usa trump trump2020,3214607327.0,40.0796606,-89.4337288,,United States of America,Illinois,IL,Welfare,0.5020102262496948,Neutral
1.321373637329539e+18,donaldtrump foodstamps pandemic,554664256.0,45.1895845,-88.7321585,,United States of America,Wisconsin,WI,Welfare,0.7261143922805786,Weakly Supports
1.3214236318477066e+18,if wins the usa will go in the shitter trump trump2020,8.42058041495294e+17,27.4989278,-82.5748194,Bradenton,United States of America,Florida,FL,Welfare,0.4254369437694549,Weakly Supports
1.3214292325437686e+18,wisconsin dairy farmer who has been propped up by govt subsidies for years speaking on praising trump and talking about how women and blacks have the same opportunities as we do with virtually no pushback from interviewer,70776910.0,18.465299,-66.11666600000001,San Juan,United States of America,Puerto Rico,PR,Welfare,0.5877234935760498,Weakly Supports
1.321433409441337e+18,the trump admin is fighting in federal court to block states from giving billions of dollars in emergency food stamps to the lowestincome americans during the coronavirus crisis great job,24061160.0,34.0536909,-118.242766,Los Angeles,United States of America,California,CA,Welfare,0.7522721290588379,Weakly Supports
1.3214407432994363e+18,thats your guy omaha trump always looks out for his peeps,1.1784648434956083e+18,40.2253569,-82.6881395,,United States of America,Ohio,OH,Welfare,0.4161311388015747,Neutral
1.3214533247266363e+18,trumps and the gops failure to protect our nation and promote the general welfare is hitting their donors wallets hard,49311478.0,41.875561600000005,-87.6244212,Chicago,United States of America,Illinois,IL,Welfare,0.4912317097187042,Weakly Supports
1.321470196327088e+18,trump trump trump trump meanings greater is not lazy devils backwards 4 more years is colors redbluegreen biden and harris poor poor poor usaworldwide kitg,1.312007621017301e+18,31.8160381,-99.5120986,,United States of America,Texas,TX,Welfare,0.4068199694156647,Neutral
1.3214830376793457e+18,deutschland 1933 amerika 2020 usa wahlen wahlkampf november3rd electionday elections2020 donaldtrump extremismus arizona,41935019.0,37.804455700000005,-122.2713563,Oakland,United States of America,California,CA,Welfare,0.6338648200035095,Neutral
1.321486818651607e+18,trump supporters idea of prosperity,17010163.0,40.2253569,-82.6881395,,United States of America,Ohio,OH,Welfare,0.6918041706085205,Neutral
1.3215070085924209e+18,putting politics before the law read my new piece about a liberal judge allowing states to illegally abuse the food stamp program trump welfare,1.1993577382975035e+18,38.8949924,-77.0365581,Washington,United States of America,District of Columbia,DC,Welfare,0.9491268992424012,Weakly Supports
1.3215092363884997e+18,trump treats supporters like he treated porn stars shut up i paid you he doesnt apologize to omahatrumprallydisaster attendees for his failure to managehe reminds them of the welfare subsidies bribe shutupandtakethemoney blackmail hushpayments,16483076.0,36.7014631,-118.7559974,,United States of America,California,CA,Welfare,0.8675440549850464,Neutral
1.3215677728921436e+18,for the greater good of your country and fellow man remember this people that wear masks are protecting you and if youre not wearing one youre risking infecting the mask wearer it should be attempted murder at this point now comes the modern trump influenced crowd,1.0251384363180852e+18,40.2253569,-82.6881395,,United States of America,Ohio,OH,Welfare,0.4141266942024231,Neutral
1.3215731805117153e+18,this is how trump cares for his flock,17123171.0,34.0194704,-118.4912273,Santa Monica,United States of America,California,CA,Welfare,0.8549851775169373,Strongly Supports
1.321632978850775e+18,i hope it is a huge recording number and secures biden the wh and trump evicted,218770703.0,43.8764519,-73.0642797,,United States of America,Vermont,VT,Welfare,0.5048124194145203,Neutral
1.3216616249908142e+18,thewonderyears but with trump vote blue bidenharris2020 biden2020,1.1252109491059876e+18,38.8949924,-77.0365581,Washington,United States of America,District of Columbia,DC,Welfare,0.5506609678268433,Neutral
1.321675022113534e+18,characteristics of captainmoroni a strong and mighty man a man who was firm in the faith of christ a man whose soul did joy in the liberty and the freedom of his country a man who did labor exceedingly for the welfare and safety of his people trump is none of that,942401612.0,40.7596198,-111.8867975,Salt Lake City,United States of America,Utah,UT,Welfare,0.4571336209774017,Neutral
1.3217518733894738e+18,biden trump wwe,99953146.0,39.5162234,-76.9382069,,United States of America,Maryland,MD,Welfare,0.625036895275116,Neutral
1.321763061078909e+18,heartless trump fights in court to block pandemic food aid for lowestincome americans via,8.108188006271754e+17,41.7962409,-71.59923719999999,,United States of America,Rhode Island,RI,Welfare,0.4070684611797333,Weakly Supports
1.3218501089469276e+18,thursdaythoughts thursdaywisdom thursdaymorning well got a chapter done of my trump zombie apocalypse novella might have time for at least one additional short story,335096977.0,40.7127281,-74.0060152,New York,United States of America,New York,NY,Welfare,0.6900933980941772,Neutral
1.3218897241691136e+18,you know you can support trump and still be an animal advocate most people can walk amp chew gum at the same time,1.26903878880793e+18,30.8703881,-92.007126,,United States of America,Louisiana,LA,Welfare,0.5864089727401733,Neutral
1.321894687754625e+18,florida seniors trump is coming after your safety net if he doesnt covid19 kill you first,3091791987.0,27.7567667,-81.4639835,,United States of America,Florida,FL,Welfare,0.5674721002578735,Neutral
1.3218976232138015e+18,woof woof most valuable explosive info that will save trump yet they took no photos or copies never existedfauxnews all they way,1.0251384363180852e+18,40.2253569,-82.6881395,,United States of America,Ohio,OH,Welfare,0.457060843706131,Neutral
1.321908938212692e+18,trump loves socialism take farmers for example he gave farmers more than 22 billion in 2019 alone thats welfare what do you call sending 200 gift cards to 33 million seniors how do we pay police fire military schools and more socialism its already here vote,240073748.0,42.33143,-83.04575,,United States of America,Michigan,MI,Welfare,0.9027811288833618,Weakly Supports
1.321943320336257e+18,trump administration ends protections for iconic gray wolf usa nature animals lobbying greed draintheswamp electionday election2020,24387693.0,34.2331373,-102.4107493,,United States of America,Texas,TX,Welfare,0.4243085980415344,Weakly Supports
1.3219711524792648e+18,trump strips protections for endangered gray wolves,3096702665.0,37.7790262,-122.4199061,San Francisco,United States of America,California,CA,Welfare,0.5045913457870483,Weakly Supports
1.3220050750998692e+18,lilwayne 50cent icecube blm thursdaywisdom philly minneapolis minnesota detroit michigan pennsylvania wisconsin trump vote2020 election2020 electionday,7.085525514074685e+17,40.3270127,-86.1746933,,United States of America,Indiana,IN,Welfare,0.4906810522079468,Neutral
1.3221767223687864e+18,wld like 2 ask animal trump supporters 2 follow ima survivor donkey and animal farm sanctuary the owners are awesome amp posted in code who they voted for trump libs doing what they do nasty comments unfollows,1327758026.0,38.8949924,-77.0365581,Washington,United States of America,District of Columbia,DC,Welfare,0.4313926994800567,Neutral
