tweet_id,clean_tweet,user_id,lat,long,city,country,state,state_code,political_label,label_score,stance
1.3165608476663726e+18,la toppa peggio del buco ora rivolta contro i social contro trump,122733775.0,28.5977707,-81.35102640000001,,United States of America,Florida,FL,Social Security,0.4643680453300476,the author does not express a clear stance on Social Security
1.3167763342748426e+18,amp trump are out doing everything humanly possible going after social security and you are posting this tripe seriously why arent you talking about what you are dong to stop it btw get back to me when you are fighting them on this front and ill actually join,14836408.0,30.3321838,-81.655651,Jacksonville,United States of America,Florida,FL,Social Security,0.9183834195137024,the author does not express a clear stance on Social Security
1.316925674804908e+18,in 2016 promised to protect socialsecurity but at a march 5th townhall when asked what hed do about entitlements if reelected he said well be cutting tom conway details the dangers a 2nd trump term poses to ss here,26350255.0,34.0536909,-118.242766,Los Angeles,United States of America,California,CA,Social Security,0.7553743720054626,the author does not express a clear stance on Social Security
1.3171115119874785e+18,yes trumps proposed permanent tax cut would gut socialsecurity by 2023 via,22950604.0,40.0757384,-74.4041622,,United States of America,New Jersey,NJ,Social Security,0.6549094319343567,the author does not express a clear stance on Social Security
1.3171337417315983e+18,is he going to tell them he planned to rob socialsecurity to pay for his autographed prescription cards he wanted to send them that he was willing to farther jeopardize most of their retirement incomes for a political stunt seniors are on to trump vote bidenharris2020,29154355.0,29.6519684,-82.3249846,Gainesville,United States of America,Florida,FL,Social Security,0.7950295805931091,the author does not express a clear stance on Social Security
1.317140511354925e+18,i really wish somebody would talk more about social security and trump cutting the payroll tax permanent that will end social security and medicare which will effect most all seniors regardless of party,2506268300.0,37.5726028,-85.1551411,,United States of America,Kentucky,KY,Social Security,0.8350732922554016,the author does not express a clear stance on Social Security
1.3171716621865656e+18,herdimmunity might work very well for trump and the gop it could free up money from socialsecurity since seniors are at the highest risk for dying from covid19,40522228.0,40.6130404,-73.9095813,New York,United States of America,New York,NY,Social Security,0.8939319252967834,the author does not express a clear stance on Social Security
1.3171776416826982e+18,folks this is simply false look it up trump constantly cuts social security in his budgets facts trump socialsecurity,86224590.0,37.7790262,-122.4199061,San Francisco,United States of America,California,CA,Social Security,0.8976914286613464,the author does not express a clear stance on Social Security
1.3172043516564234e+18,by trying to omit the fica payroll tax thereby ensuring the socialsecurity funds will dry up within 2 years thats the gop and trump plan,7.240125605345075e+17,21.304547,-157.8556764,Honolulu,United States of America,Hawaii,HI,Social Security,0.7094475626945496,the author opposes Social Security or supports cutting Social Security benefits
1.3172742055164314e+18,rick gaetz will lie for trump because if florida knew trump and the republicans are planning to end social security by 2023 they would lose florida,33407966.0,27.9477595,-82.458444,Tampa,United States of America,Florida,FL,Social Security,0.737910270690918,the author does not express a clear stance on Social Security
1.3172837178203873e+18,yet trump wants to cut ss,2493013459.0,38.7604815,-92.5617875,,United States of America,Missouri,MO,Social Security,0.5872028470039368,the author opposes Social Security or supports cutting Social Security benefits
1.3172944040345068e+18,this is america today she is one of millions of citizens who are suffering yet president trump amp congress dont care and the president amp republicans want to cut socialsecurity further forcing older citizens into extreme poverty the us is broken,551236965.0,38.8949924,-77.0365581,Washington,United States of America,District of Columbia,DC,Social Security,0.7481265664100647,the author does not express a clear stance on Social Security
1.3172946272385065e+18,trumps plans for socialsecurity a fulfill a campaign promise to run the government like ran his businessesinto bankruptcy b wipe out all the seniors amp voters so they wont collect what they earned dumptrump to maga,7.545927464054497e+17,34.2331373,-102.4107493,,United States of America,Texas,TX,Social Security,0.8845109343528748,the author opposes Social Security or supports cutting Social Security benefits
1.3175366387723878e+18,seniors do not believe anything trump says covid19liar 2021trumpbudget cuts socialsecurity trumpiskillingtheaca healthcare,33590010.0,27.7567667,-81.4639835,,United States of America,Florida,FL,Social Security,0.5599866509437561,the author does not express a clear stance on Social Security
1.3175768511419105e+18,magas seniorsunsure socialsecurity to the wall funding or spaceforce foxnews unhappy about that president trump complained about the volume of negative ads being run against him on fox news fox news allows more negative ads on me,141025131.0,37.1232245,-78.4927721,,United States of America,Virginia,VA,Social Security,0.5695466995239258,the author does not express a clear stance on Social Security
1.31763727207911e+18,if trump amp the gop keep covid19 spiking amp the covidiots from wearing masks then they wont have to worry about backing social security amp medicare all of us seniors amp those out on disability will be dead they can then spend our tax s for their pet projects voteblue2020,1.244418851737043e+18,42.3315509,-83.04664029999999,Detroit,United States of America,Michigan,MI,Social Security,0.4883254766464233,the author supports expanding or preserving Social Security benefits
1.31820740058377e+18,most of florida counties are blue for biden why maybe because trump has started defunding social security and medicare so that it would be depleted by 2023 this is the trump plan destroy everything so that you would be desperate for anything,33407966.0,27.9477595,-82.458444,Tampa,United States of America,Florida,FL,Social Security,0.4569347202777862,the author does not express a clear stance on Social Security
1.3182328914496143e+18,trump wants to destroy social security its a fact,1.2577031149599252e+18,39.4018552,-76.602388,Towson,United States of America,Maryland,MD,Social Security,0.7075164914131165,the author opposes Social Security or supports cutting Social Security benefits
1.3182530887849206e+18,president trumps position on socialsecurity is at odds with what the majority of americans want finance retirement economy,22873354.0,40.8679538,-74.5601181,,United States of America,New Jersey,NJ,Social Security,0.9642180800437928,the author does not express a clear stance on Social Security
1.3182917402610117e+18,trump hates seniors herdimmunity herdimmunityismassmurder trump called seniorcitizens nobody he is willing to sacrifice millions of americans to accomplish what he calls herdmentality prices are soaring socialsecurity colaonly 13 disgraceful voteearly,240073748.0,42.33143,-83.04575,,United States of America,Michigan,MI,Social Security,0.4588571190834045,the author opposes Social Security or supports cutting Social Security benefits
1.318557450858041e+18,so trump is trying to scare voters with the threat of socialism socialism including socialsecurity and medicare socialism involves our police road maintenance firedepartments and other services we take for granted,8.90653225430528e+17,27.7567667,-81.4639835,,United States of America,Florida,FL,Social Security,0.4887523949146271,the author does not express a clear stance on Social Security
1.318671756081574e+18,trump might have increased our 401k balance but he would empty future social security funds to pay for lowering taxes on the rich making sure he can keep paying 750 per year while middle class pays thousands,8.199782412512952e+17,36.7014631,-118.7559974,,United States of America,California,CA,Social Security,0.5739430785179138,the author does not express a clear stance on Social Security
1.3187771209072353e+18,why does 5 carry false ads from china joe biden claiming potus trump is going to take social security away from the recipients also when you covered the anti columbus troublemakers a female was holding a sign which read fuck columbus both of these are facts 5s a disgrace,241733133.0,42.3788774,-72.03236600000001,,United States of America,Massachusetts,MA,Social Security,0.7264792323112488,the author opposes Social Security or supports cutting Social Security benefits
1.318922820143833e+18,trump is so full of here hes already very publicly considered suspending the payroll tax which is the funding source for social security an action which would have killed the program dont let trump or the gop get within a mile of your loved ones social security,575549560.0,37.2638324,-122.0230146,,United States of America,California,CA,Social Security,0.7822126150131226,the author does not express a clear stance on Social Security
1.3189550338498191e+18,trump terminator of socialsecurity,37360911.0,34.0536909,-118.242766,Los Angeles,United States of America,California,CA,Social Security,0.551213264465332,the author opposes Social Security or supports cutting Social Security benefits
1.3191230304387072e+18,trump supporters dont care if he tells the truth or not theyre against the govt amp he doesnt act ampor speak like any politician let alone a president when social security amp medicare goes broke or away then they might wake up,1.244418851737043e+18,42.3315509,-83.04664029999999,Detroit,United States of America,Michigan,MI,Social Security,0.4273002445697784,the author does not express a clear stance on Social Security
1.319312966576124e+18,trump is bad for business government or private socialsecurity,16327808.0,38.8949924,-77.0365581,Washington,United States of America,District of Columbia,DC,Social Security,0.7348054051399231,the author does not express a clear stance on Social Security
1.3193276067229942e+18,joebiden read donaldtrump his pan from pg40 through 60 he plans on taxing people who make 50k placing taxes on social security and if you own your home he wants to tax that on top of your property tax read be informed trump2020,260708421.0,38.0464066,-84.4970393,Lexington,United States of America,Kentucky,KY,Social Security,0.5575883984565735,the author opposes Social Security or supports cutting Social Security benefits
1.3193626115075482e+18,trumps business and tax wreckords shine a light on his complete untrustworthiness wiht socialsecurity and medicare seniorsbeware,16327808.0,38.8949924,-77.0365581,Washington,United States of America,District of Columbia,DC,Social Security,0.5880863666534424,the author does not express a clear stance on Social Security
1.319395081409921e+18,sc voters magas maga trump this is what lindsey thinks of you,1.3121476123725332e+18,31.8160381,-99.5120986,,United States of America,Texas,TX,Social Security,0.4813682436943054,the author does not express a clear stance on Social Security
1.3194063318753894e+18,i wish the presidentialdebate2020 biden and trump didnt know ahead of time what the issues are that would be discussed in the debatenight but if you had to include issues if i were the i would have argued for what is the future of socialsecurity,270732061.0,37.7790262,-122.4199061,San Francisco,United States of America,California,CA,Social Security,0.715261697769165,the author does not express a clear stance on Social Security
1.319451586096083e+18,you know what it is right trump its that payroll tax relief amp i use relief lightly that youve called yourself giving ppl that money is what supports social security thats why it will be broke by 2023 if u remain n office do tell how u will financially support all seniors,1161988002.0,35.052575899999994,-78.878292,Fayetteville,United States of America,North Carolina,NC,Social Security,0.6104946732521057,the author does not express a clear stance on Social Security
1.3194573716059136e+18,debate trump talking abt socialsecurity is a joke mute button,14851523.0,40.7127281,-74.0060152,New York,United States of America,New York,NY,Social Security,0.647374153137207,the author does not express a clear stance on Social Security
1.3194574870958858e+18,biden claims trump is going to bankrupt socialsecurity,2961947202.0,36.7014631,-118.7559974,,United States of America,California,CA,Social Security,0.7999502420425415,the author opposes Social Security or supports cutting Social Security benefits
1.3194574927206031e+18,voters who matter senior citizens joebiden talks about socialsecurity going bankrupt by 2023 if nothing is done donaldtrump responds that that wall street is booming debates2020,26061966.0,38.8949924,-77.0365581,Washington,United States of America,District of Columbia,DC,Social Security,0.8057636022567749,the author does not express a clear stance on Social Security
1.3194575384133673e+18,says that trump will bankrupt social security and notes that he tried to cut medicare trump is going back in time blaming something he says joe did long agonow hes blaming for stock marketyet obamabiden had a very good economic track record,208607949.0,42.3788774,-72.03236600000001,,United States of America,Massachusetts,MA,Social Security,0.8088231682777405,the author opposes Social Security or supports cutting Social Security benefits
1.319457671699837e+18,biden under trump social security will be bankrupt by 2023 and this guy is trying to lecture me on healthcare and social security cmon trump biden debate2020 debates debates2020 kdwebster,1.1020969833496945e+18,39.613321,-105.0166498,,United States of America,Colorado,CO,Social Security,0.7401947975158691,the author does not express a clear stance on Social Security
1.3194576787881574e+18,trump he tried to hurt and kill social security years ago he did if hes elected the stock market will crash if im elected its a boom if hes elected it will crash biden most people dont live by the stock market nice debates2020,8436472.0,45.5202471,-122.6741949,Portland,United States of America,Oregon,OR,Social Security,0.5057684779167175,the author opposes Social Security or supports cutting Social Security benefits
1.3194577114829537e+18,who do you trust more with your social security biden2020 debate2020 trump2020 biden trump,574825588.0,32.2240728,-98.2036289,,United States of America,Texas,TX,Social Security,0.7790082097053528,the author does not express a clear stance on Social Security
1.3194578573440532e+18,yall trump is losing it he tried to take social security well he tried to take it a long time ago badlying presidentialdebate2020,1.3071469867857715e+18,31.8160381,-99.5120986,,United States of America,Texas,TX,Social Security,0.907263994216919,the author does not express a clear stance on Social Security
1.3194583630890598e+18,anybody who thinks that trump will fup socialsecurity is a moron joebiden is wrong socialsecurity was fdup years ago we are lucky that it is still helping people trump wasnt in office when this all got fdup thats years in the making,72293918.0,35.108493100000004,-77.04411429999999,,United States of America,North Carolina,NC,Social Security,0.9513575434684752,the author does not express a clear stance on Social Security
1.319459994337792e+18,this guy trump must not know who hes talking too hes trying to lecture me on socialsecurity amp medicare come on burn cnn trumpmeltdown presidentialdebate2020,3693869893.0,32.7174209,-117.1627714,San Diego,United States of America,California,CA,Social Security,0.4302705824375152,the author does not express a clear stance on Social Security
1.3194709521078682e+18,trump said his followers have 401ks does diabetes and obesity based ssi come with a 401k option,4013698889.0,40.7127281,-74.0060152,New York,United States of America,New York,NY,Social Security,0.7039706110954285,the author does not express a clear stance on Social Security
1.319471059557466e+18,biggest trump lies 1 hes done more for black people than anyone since abrahamlincoln 2 biden will destroy socialsecurity amp stock market will crash 3 immigrant children were brought here by coyotes debates2020,22671315.0,47.6038321,-122.3300624,Seattle,United States of America,Washington,WA,Social Security,0.5621927380561829,the author opposes Social Security or supports cutting Social Security benefits
1.31951788477995e+18,lets get real trump is not behind the stock market success the dollar has been tanking since he took office in 2016 and will be impacting socialsecurity with his planned future taxcuts the economy is hurting and will need further fixing,74670021.0,36.7014631,-118.7559974,,United States of America,California,CA,Social Security,0.5334535241127014,the author does not express a clear stance on Social Security
1.3196597022513766e+18,well deathsantis has to help his daddy trump decrease the socialsecurity rolls somehow,9.323152713727264e+17,37.5726028,-85.1551411,,United States of America,Kentucky,KY,Social Security,0.6352091431617737,the author opposes Social Security or supports cutting Social Security benefits
1.319682902557397e+18,for older people biden has a plan to bolster socialsecurity amp he has accused mr trump of threatening the future of that program,1.0471576229300716e+18,43.1561681,-75.84499459999999,,United States of America,New York,NY,Social Security,0.7826662659645081,the author supports expanding or preserving Social Security benefits
1.3196829995128218e+18,debates2020 trump responds to health care debate socialsecurity will run out by 2023 biden has a plan but does not say what it is if trump withholds tax cuts we run out biden says we should increase the tax,321427049.0,45.5202471,-122.6741949,Portland,United States of America,Oregon,OR,Social Security,0.520940363407135,the author does not express a clear stance on Social Security
1.319749433525846e+18,your version of protection and rounding the turn from covid19 is killing us why should we believe any of your bs re social security or anything else trump,1.2654250073263227e+18,34.0143928,-117.898451,,United States of America,California,CA,Social Security,0.7091668844223022,the author does not express a clear stance on Social Security
1.319753845803643e+18,first to die under the trump administrations convid19 response plan do you think when trump said its a god sent he was referring to instead of the goal to get rid of socialsecurity they now can get rid of the seniorcitizens recipients,541848155.0,36.7014631,-118.7559974,,United States of America,California,CA,Social Security,0.7358188629150391,the author opposes Social Security or supports cutting Social Security benefits
1.3197662998581944e+18,trump threatens both medicare amp socialsecurity his irrational diatribes against socialism are veiled attacks against social safety net programs run by the government the president sees 401ks as the sole retirement insurance he clearly opposes public social programs,8.179032968033116e+17,34.0536909,-118.242766,Los Angeles,United States of America,California,CA,Social Security,0.4327743351459503,the author opposes Social Security or supports cutting Social Security benefits
1.3197868871382057e+18,erinburnett ask the trump dummy aka hogan if donaldtrump truly believes social securityamp medicare is supposed to be protected at all cost why it it destin to be bankruptamp unable to pay benefits in 3 years if trump doesnt do something social security will go broke,4072327265.0,39.7683331,-86.1583502,Indianapolis,United States of America,Indiana,IN,Social Security,0.5913111567497253,the author does not express a clear stance on Social Security
1.3198027288816845e+18,trump the rally master says im into clips trump then shows a clip of bernie attacking joe for cutting medicaid and social security trump then says thank you bernie,1.2906351101491692e+18,38.8949924,-77.0365581,Washington,United States of America,District of Columbia,DC,Social Security,0.4086390435695648,the author does not express a clear stance on Social Security
1.3198283206247956e+18,seniors need to read these bullets as trump facts vs joebiden targeting cuts amp prior attempts to cut all programs amp socialsecurity as video in comments shows,2890462752.0,40.0757384,-74.4041622,,United States of America,New Jersey,NJ,Social Security,0.904297173023224,the author opposes Social Security or supports cutting Social Security benefits
1.319913037323817e+18,maga maga2020 trump i am sure magas dont wasnt any of their social security,1.3121476123725332e+18,31.8160381,-99.5120986,,United States of America,Texas,TX,Social Security,0.654887855052948,the author does not express a clear stance on Social Security
1.3199749291404698e+18,truth all i know is growing up my whole life i heard there will be no ssi the government pretrump mismanaged it from my mid 20s on this was known my generation was screwed with ssi amp taking care of the baby boomers it wasnt trump democratsaredestroyingamerica,119223484.0,40.0757384,-74.4041622,,United States of America,New Jersey,NJ,Social Security,0.6360390782356262,the author does not express a clear stance on Social Security
1.3200176640482714e+18,in essence it is the gop right who have installed death panels to determine who gets to live and die during covid19 in view seniors are expendable goes even beyond coronavirus as trump and the gop gut social security and medicare which many seniors depend on,2238271674.0,29.949932300000004,-90.0701156,New Orleans,United States of America,Louisiana,LA,Social Security,0.5618637800216675,the author does not express a clear stance on Social Security
1.3200434761556582e+18,trumps assault on medicare amp socialsecurity is a terrifying prospect for seniors his hardened ideological stand against socialism puts older americans at great risk of losing their critical safety net a vote for biden will assure the health of these programs,8.179032968033116e+17,34.0536909,-118.242766,Los Angeles,United States of America,California,CA,Social Security,0.5708735585212708,the author does not express a clear stance on Social Security
1.3200627021952164e+18,biden has always advocated cutting social security in his own words trump targets older voters with an ad focusing on social security and medicare,517717921.0,33.5723191,-81.61820859999999,,United States of America,South Carolina,SC,Social Security,0.8893449902534485,the author opposes Social Security or supports cutting Social Security benefits
1.3200779089757676e+18,1 to make matters worse trump has taken action to unilaterally eliminate social securitys dedicated funding and has promised that if reelected he will terminate it,1.0855593705141372e+18,35.042464200000005,-88.8914692,,United States of America,Tennessee,TN,Social Security,0.7387716770172119,the author opposes Social Security or supports cutting Social Security benefits
1.3200958378846577e+18,sc trump,7.996335320291779e+17,35.01679179999999,-81.8039916,,United States of America,South Carolina,SC,Social Security,0.525485098361969,the author does not express a clear stance on Social Security
1.3200976813650575e+18,trump has stopped collecting the payroll tax which funded social security and medicare trump is the antichrist hes trying to destroy america because trumpisatraitor,1.2372230186753638e+18,36.1672559,-115.1485163,Las Vegas,United States of America,Nevada,NV,Social Security,0.4238641560077667,the author opposes Social Security or supports cutting Social Security benefits
1.320097742035845e+18,even socialist bernie called joe biden out for trying to get social security medicare amp veterans programs cut hey report the news joebiden bidenslies vote trump votered,624306656.0,41.0534302,-73.53873409999999,Stamford,United States of America,Connecticut,CT,Social Security,0.5037671327590942,the author opposes Social Security or supports cutting Social Security benefits
1.3200985649959526e+18,trump in 2015 im not going to cut social security like every other republican and im not going to cut medicare or medicaid trumps 2020 budget breaks one of his biggest campaign promises to voters,12072382.0,36.1622296,-86.7743531,Nashville,United States of America,Tennessee,TN,Social Security,0.5272459387779236,the author does not express a clear stance on Social Security
1.3201604151297188e+18,lyingchinajoebiden is running false ads on television in massachusetts claiming potus trump wants to take ones social security away heres the truth biden stands quilty of such and must be shown america loves honesty in the presidental office trump2020tosaveamerica,241733133.0,42.3788774,-72.03236600000001,,United States of America,Massachusetts,MA,Social Security,0.571018636226654,the author opposes Social Security or supports cutting Social Security benefits
1.3201642200386396e+18,not just socialsecurity elimination by trump but this move in 2018 will cut pensions this seems to be another example of who you know rather than what you know via,74670021.0,36.7014631,-118.7559974,,United States of America,California,CA,Social Security,0.9530864953994752,the author does not express a clear stance on Social Security
1.3204978828023276e+18,screw you old farts in the villages voting for trump florida trump hes trying to destroy social security youre too fucking stupid to get it,1.2577031149599252e+18,39.4018552,-76.602388,Towson,United States of America,Maryland,MD,Social Security,0.7996143698692322,the author opposes Social Security or supports cutting Social Security benefits
