tweet_id,clean_tweet,user_id,lat,long,city,country,state,state_code,political_label,label_score,stance
1.320519860804153e+18,donaldtrump and his republican allies want to dismantle socialsecurity amp medicare if you support that you should vote trump but be clear if you are interested in maintaining those two vital programs you need to vote for biden know the issues and then decide,1676694750.0,34.0536909,-118.242766,Los Angeles,United States of America,California,CA,Social Security,0.4116509556770324,the author does not express a clear stance on Social Security
1.3205251240810865e+18,the screeds and rants warning against the impending socialist takeover of the unitedstates have many voters wondering why trump would threaten socialsecurity amp medicare in the middle of a pandemic medicare is essential for the wellbeing of seniors we must stop trump,1676694750.0,34.0536909,-118.242766,Los Angeles,United States of America,California,CA,Social Security,0.4298425614833832,the author does not express a clear stance on Social Security
1.3205596433625293e+18,omg republican congress and trump give up battle coronavirus but not in confirming amycomeybarrettpriorities are insurance companies money say bye bye to socialsecurity benefits woman rights tomorrow fight supremecourt,161151263.0,18.4496551,-67.1184764,,United States of America,Puerto Rico,PR,Social Security,0.5251558423042297,the author opposes Social Security or supports cutting Social Security benefits
1.3206845843300884e+18,putin and trump hate their citizens and are purposely killing old people to save pension socsec payouts,371552020.0,47.2868352,-120.2126139,,United States of America,Washington,WA,Social Security,0.4986172318458557,the author opposes Social Security or supports cutting Social Security benefits
1.320772160730792e+18,please try to convince the republican party and donaldtrump to protect socialsecurity amp medicare trump continues to rail against social programs with his radical economic ideology our seniors depend on these government programs,1676694750.0,34.0536909,-118.242766,Los Angeles,United States of America,California,CA,Social Security,0.7844060063362122,the author supports expanding or preserving Social Security benefits
1.320775688132137e+18,trump says he will terminate social security republicans common dreams banner logo via,7.927013068047647e+17,31.6201479,-96.2847875,,United States of America,Texas,TX,Social Security,0.7000138759613037,the author opposes Social Security or supports cutting Social Security benefits
1.321211212819026e+18,trump and biden vastly different positions on social security trump biden election2020 socialsecurity,106835469.0,32.3140354,-106.7798078,Las Cruces,United States of America,New Mexico,NM,Social Security,0.93940532207489,the author does not express a clear stance on Social Security
1.321324478492795e+18,you and me bothactually been dealing with a little anxiety in a couple years im going to need social security and probably the aca as well i hate trump for causing american citizens pain and anguishanyways 2020 has been a real mfr,799406750.0,39.7392364,-104.9848623,Denver,United States of America,Colorado,CO,Social Security,0.6522274017333984,the author does not express a clear stance on Social Security
1.321495276499206e+18,nothing in president trumps order affects socialsecuritys solvency the order simply allows employers to defer a portion of payroll taxes for a few months until next year,14907290.0,35.227208600000004,-80.84308270000001,Charlotte,United States of America,North Carolina,NC,Social Security,0.8286722302436829,the author does not express a clear stance on Social Security
1.3214959445008384e+18,nothing in president trumps order affects socialsecuritys solvency the order simply allows employers to defer a portion of payroll taxes for a few months until next year,9.968704259080764e+17,35.227208600000004,-80.84308270000001,Charlotte,United States of America,North Carolina,NC,Social Security,0.8286726474761963,the author does not express a clear stance on Social Security
1.3215189910520996e+18,trump2020 is listing ending of covid pandemic and saved social security he is a lying sob why are you republicans so damn dumb plus you amp trump are spreading covid,66036220.0,32.7762719,-96.7968559,Dallas,United States of America,Texas,TX,Social Security,0.7144372463226318,the author supports expanding or preserving Social Security benefits
1.3215934546700616e+18,just saw a joebiden ad on tv claiming that trump is threatening social security and medicare heard other dems claim the same yet i have never heard of it anywhere else so where is this coming from are they just making stuff up again,7.421872013337272e+17,30.8703881,-92.007126,,United States of America,Louisiana,LA,Social Security,0.4208570718765259,the author opposes Social Security or supports cutting Social Security benefits
1.3217043692098355e+18,if trump gets reelected social security and medicare will disappear hes promised to extend reductions to social security which now amount to 1 trillion cuts to disability medicaremedicaid programs others eliminating the payroll tax will gut them votehimout2020,1.1731448251571282e+18,34.2331373,-102.4107493,,United States of America,Texas,TX,Social Security,0.6620480418205261,the author opposes Social Security or supports cutting Social Security benefits
1.321794193707004e+18,are senior voters really so stupid as to believe joebiden ads that claim trump will eliminate social security really i guess well find outelection2020,143598061.0,36.1672559,-115.1485163,Las Vegas,United States of America,Nevada,NV,Social Security,0.8060311675071716,the author does not express a clear stance on Social Security
1.3218123421124772e+18,does that mean im going to earn 4000 next year trump understand bernie lost biden the moderate beat bernie the socialist you know social security is a socialist policy my retirement accounts have already tanked under youtodays headline,7.805812026966467e+17,40.8517224,-73.0992188,,United States of America,New York,NY,Social Security,0.5047075152397156,the author does not express a clear stance on Social Security
1.32204391188011e+18,trump cant learn to rap since he only knows 70sera arm points also all his thumbsup pics are just photoops with people he hardly knows allegedly lilwayne trump,42547269.0,43.9792797,-120.737257,,United States of America,Oregon,OR,Social Security,0.6032018065452576,the author does not express a clear stance on Social Security
1.3221899601082778e+18,floridians and all thinking people know that trump and the gop are out to steal your social security your savings and your security trump potus potus45,7.032670830276608e+17,39.9527237,-75.16352619999999,Philadelphia,United States of America,Pennsylvania,PA,Social Security,0.8093782067298889,the author opposes Social Security or supports cutting Social Security benefits
1.322208342803034e+18,is anyone concerned about what trump and the republicans are doing to social security,219554555.0,47.6038321,-122.3300624,Seattle,United States of America,Washington,WA,Social Security,0.8008757829666138,the author does not express a clear stance on Social Security
1.3222109257602785e+18,the one thing tiffanytrump had going over donaldtrumps other 3 almostadult children was that you didnt think she was an idiot bc she stayed out of the public eye well thats over shes just as stupid as they are covid19 socialdistance for gods sake,7.512911815861903e+17,34.4221319,-119.7026673,Santa Barbara,United States of America,California,CA,Social Security,0.6372681260108948,the author does not express a clear stance on Social Security
1.3222223095543644e+18,retirees voting for trump is not in your best interest his words are empty and meaningless he wants to cut social security and eliminate the aca the truth is he cares about no one but himself liarinchief trumplies trumpliesamericansdie,35672554.0,36.4072377,-105.5732847,,United States of America,New Mexico,NM,Social Security,0.6796492338180542,the author opposes Social Security or supports cutting Social Security benefits
1.3222433448319672e+18,i wonder what sc numbers are looking like for trump toady lindseygraham,38282048.0,42.3602534,-71.0582912,Boston,United States of America,Massachusetts,MA,Social Security,0.4350494146347046,the author does not express a clear stance on Social Security
1.3222483975549133e+18,breitbart news joe biden said president trump would cut socialsecurity he challenged his audience google it so people did and found out that biden was lyingagain,7.964558269825843e+17,40.0757384,-74.4041622,,United States of America,New Jersey,NJ,Social Security,0.8190687298774719,the author opposes Social Security or supports cutting Social Security benefits
1.322253740221567e+18,trump has done a damn thing to hurt social security congress ruin that a long time ago just stop trumpcutsocialsecurity,636296536.0,27.7567667,-81.4639835,,United States of America,Florida,FL,Social Security,0.952077090740204,the author does not express a clear stance on Social Security
1.3222573247451218e+18,moscowmitch agreed to the billionaire cash grab tax bill because he know it would bankrupt social security trump is coming for you healthcare trumpdeath repealandreplacetrump2020 votingforbiden,7.59241775454253e+17,40.7896239,-73.9598939,New York,United States of America,New York,NY,Social Security,0.4227289855480194,the author opposes Social Security or supports cutting Social Security benefits
1.3222579789223117e+18,trump is defunding social security through the payroll tax cut and wants to make it permanent disability payments end next year social security ends in 2023 trumpcutsocialsecurity,389932033.0,31.8160381,-99.5120986,,United States of America,Texas,TX,Social Security,0.834923267364502,the author opposes Social Security or supports cutting Social Security benefits
1.3222596552555602e+18,trumpcutsocialsecurity trumpcrimefamily trump trumpisnotamerica,2192634212.0,38.7604815,-92.5617875,,United States of America,Missouri,MO,Social Security,0.5451489686965942,the author opposes Social Security or supports cutting Social Security benefits
1.322264534602666e+18,socialsecurity i paid payroll taxes into the ss fund for 40 years if trump mucks it up the very year i finally benefit from it i cannot imagine how i can put money aside for my disabled childs future biden,1.2730156740892303e+18,36.8529841,-75.9774183,Virginia Beach,United States of America,Virginia,VA,Social Security,0.7803343534469604,the author does not express a clear stance on Social Security
1.3222687834115195e+18,do the seniors in your life know that trump and republicans are trying to cut off the revenue stream for social security and medicaid this is todays gop they dont care about us trump gop maga election2020 voteblue2020 votethemallout trumpcutsocialsecurity vote blue,4132841.0,29.9978185,-83.2221527,,United States of America,Florida,FL,Social Security,0.6955305337905884,the author opposes Social Security or supports cutting Social Security benefits
1.3222755335399424e+18,trumpcutsocialsecurity votehimout dumptrump trumpisaliar trumpvirus trumpisaracist trumpisaloser vote votetrumpout2020 votetrumpout pos bidenharrislandslide2020 bidenharris trump donaldtrump bidenharris2020 bluewave kamalaharris biden,992307060.0,43.1561681,-75.84499459999999,,United States of America,New York,NY,Social Security,0.5440251231193542,the author opposes Social Security or supports cutting Social Security benefits
1.3222822554029138e+18,trump the lights are growing dim i know a life of crime has led me to this sorry fate and yet i blame society society made me what i am trumpcutsocialsecurity trumpcrimefamily,14403637.0,41.875561600000005,-87.6244212,Chicago,United States of America,Illinois,IL,Social Security,0.4938614070415497,the author opposes Social Security or supports cutting Social Security benefits
1.3223641759480914e+18,100 million doses promised by tomorrow another 300million doses by january bullshit the plan wasisand always will be to culltheherd and killtheelders im 73 trump wants my socialsecurity benefits losttrumphistoryoct30 losttrumphistory,9.16084198590632e+17,41.875561600000005,-87.6244212,Chicago,United States of America,Illinois,IL,Social Security,0.5011694431304932,the author opposes Social Security or supports cutting Social Security benefits
1.322403702490067e+18,trump socialsecurity trumpcutsocialsecurity vote2020 votehimout,1.1731448251571282e+18,34.2331373,-102.4107493,,United States of America,Texas,TX,Social Security,0.8660584688186646,the author opposes Social Security or supports cutting Social Security benefits
1.322497895950594e+18,people also need to understand what trumps probably doing hell tell people thats money back in their paycheck to spend but since employers contribute an equal match to the employees deduction its really a huge gift to the employers savesocialsecurity,8.837993968146063e+17,40.0757384,-74.4041622,,United States of America,New Jersey,NJ,Social Security,0.6881680488586426,the author does not express a clear stance on Social Security
1.3226924864317276e+18,my third different ig account has been deactivated in the past 30 days just because i support trump and cover the truth about the biden family the ds and the 0rrupt10n on the f4rl3ft this has to stop social medi4 pl4tf0rms are behaving like n 4 z i sthis is america btw,574806463.0,30.6943566,-88.04305409999999,Mobile,United States of America,Alabama,AL,Social Security,0.5385057926177979,the author does not express a clear stance on Social Security
1.3227448892605972e+18,trump is killing socialsecurity via,8.244656492715336e+17,44.9772995,-93.2654692,Minneapolis,United States of America,Minnesota,MN,Social Security,0.6071441769599915,the author opposes Social Security or supports cutting Social Security benefits
1.3227633493068677e+18,vote for trump and lose your socialsecurity he has fixed it to end february but if he is re elected it will be sooner im 80 that is what i live on what does your grandma or pop use for food electric water phone clothes money for their church tithe,3249050511.0,35.7730076,-86.28200809999998,,United States of America,Tennessee,TN,Social Security,0.6842496991157532,the author does not express a clear stance on Social Security
1.3228203757560832e+18,trump with his chinese bank account put iowa farmers on social security iowans want 4 more years of that instead of selling produce votebidenharristoendthisnightmare voteblue2020 votehimout,9.629646880939704e+17,29.4246002,-98.4951405,San Antonio,United States of America,Texas,TX,Social Security,0.4070011973381042,the author supports expanding or preserving Social Security benefits
1.3231155674658324e+18,seniors socialsecurityrecipients trump and the are planning on getting rid of our social security medicare and medicaid votethemallout,24970656.0,40.0796606,-89.4337288,,United States of America,Illinois,IL,Social Security,0.6410830020904541,the author opposes Social Security or supports cutting Social Security benefits
1.3231572008486953e+18,2 days trumpdeliverednothing votebiden harrisletswinthis trumpcutssocialsecurity justicematters trump showupandvote trumphatesourtroops voteagainsttrump trumpliedpeopledied votefordemocracy votehimout trumpprojection dumptrump toobigtorig toorealtosteal,278038424.0,29.7589382,-95.3676974,Houston,United States of America,Texas,TX,Social Security,0.4632637500762939,the author opposes Social Security or supports cutting Social Security benefits
1.3231573568307405e+18,trumpdeliverednothing votebiden harrisletswinthis trumpcutssocialsecurity justicematters trump showupandvote trumphatesourtroops voteagainsttrump trumpliedpeopledied votefordemocracy votehimout trumpprojection dumptrump toobigtorig toorealtosteal,278038424.0,29.7589382,-95.3676974,Houston,United States of America,Texas,TX,Social Security,0.5208677053451538,the author opposes Social Security or supports cutting Social Security benefits
1.3232654559523348e+18,trumpdeliverednothing votebiden harrisletswinthis trumpcutssocialsecurity justicematters trump showupandvote trumphatesourtroops voteagainsttrump trumpliedpeopledied votehimout trumpprojection gopsuperspreaders toobigtorig toorealtosteal,278038424.0,29.7589382,-95.3676974,Houston,United States of America,Texas,TX,Social Security,0.4741513431072235,the author opposes Social Security or supports cutting Social Security benefits
1.323266413801427e+18,trumpdeliverednothing votebiden harrisletswinthis trumpcutssocialsecurity justicematters trump showupandvote trumphatesourtroops voteagainsttrump trumpliedpeopledied votehimout trumpprojection gopsuperspreaders toobigtorig toorealtosteal,278038424.0,29.7589382,-95.3676974,Houston,United States of America,Texas,TX,Social Security,0.4741513431072235,the author opposes Social Security or supports cutting Social Security benefits
1.3232667135222292e+18,trumpdeliverednothing votebiden harrisletswinthis trumpcutssocialsecurity justicematters trump showupandvote trumphatesourtroops voteagainsttrump trumpliedpeopledied votehimout trumpprojection gopsuperspreaders toobigtorig toorealtosteal,278038424.0,29.7589382,-95.3676974,Houston,United States of America,Texas,TX,Social Security,0.4741513431072235,the author opposes Social Security or supports cutting Social Security benefits
1.323267706343301e+18,trumpdeliverednothing votebiden harrisletswinthis trumpcutssocialsecurity justicematters trump showupandvote trumphatesourtroops voteagainsttrump trumpliedpeopledied votehimout trumpprojection gopsuperspreaders toobigtorig toorealtosteal,278038424.0,29.7589382,-95.3676974,Houston,United States of America,Texas,TX,Social Security,0.4741513431072235,the author opposes Social Security or supports cutting Social Security benefits
1.3232677516543631e+18,trumpdeliverednothing votebiden harrisletswinthis trumpcutssocialsecurity justicematters trump showupandvote trumphatesourtroops voteagainsttrump trumpliedpeopledied votehimout trumpprojection gopsuperspreaders toobigtorig toorealtosteal,278038424.0,29.7589382,-95.3676974,Houston,United States of America,Texas,TX,Social Security,0.4741513431072235,the author opposes Social Security or supports cutting Social Security benefits
1.3232677834010665e+18,trumpdeliverednothing votebiden harrisletswinthis trumpcutssocialsecurity justicematters trump showupandvote trumphatesourtroops voteagainsttrump trumpliedpeopledied votehimout trumpprojection gopsuperspreaders toobigtorig toorealtosteal,278038424.0,29.7589382,-95.3676974,Houston,United States of America,Texas,TX,Social Security,0.4741513431072235,the author opposes Social Security or supports cutting Social Security benefits
1.3232680385909473e+18,trumpdeliverednothing votebiden harrisletswinthis trumpcutssocialsecurity justicematters trump showupandvote trumphatesourtroops voteagainsttrump trumpliedpeopledied votehimout trumpprojection gopsuperspreaders toobigtorig toorealtosteal,278038424.0,29.7589382,-95.3676974,Houston,United States of America,Texas,TX,Social Security,0.4741513431072235,the author opposes Social Security or supports cutting Social Security benefits
1.3232689990739436e+18,trumpdeliverednothing votebiden harrisletswinthis trumpcutssocialsecurity justicematters trump showupandvote trumphatesourtroops voteagainsttrump trumpliedpeopledied votehimout trumpprojection gopsuperspreaders toobigtorig toorealtosteal,278038424.0,29.7589382,-95.3676974,Houston,United States of America,Texas,TX,Social Security,0.4741513431072235,the author opposes Social Security or supports cutting Social Security benefits
1.323271983459717e+18,i followup with my social security twitter you better pull head out of ass and do the same if trump wins election2020,34705390.0,31.8160381,-99.5120986,,United States of America,Texas,TX,Social Security,0.8529468774795532,the author does not express a clear stance on Social Security
1.323278375922864e+18,social securitysocialism medicaresocialism medicaidsocialism roadssocialism bridgessocialism uspssocialism snow plow truckssocialism trumpfascism,1954660214.0,43.6211955,-84.6824346,,United States of America,Michigan,MI,Social Security,0.6289190053939819,the author supports expanding or preserving Social Security benefits
1.3232845464655503e+18,trumpdeliverednothing votebiden harrisletswinthis trumpcutssocialsecurity justicematters trump showupandvote trumphatesourtroops voteagainsttrump trumpliedpeopledied votehimout trumpprojection gopsuperspreaders toobigtorig toorealtosteal,278038424.0,29.7589382,-95.3676974,Houston,United States of America,Texas,TX,Social Security,0.4741513431072235,the author opposes Social Security or supports cutting Social Security benefits
1.3233197217862492e+18,cant waitbiden harris will win by a landslide trumpdeliverednothing votebiden harris letswinthis trumpcutssocialsecurity justicematters trump showupandvote voteagainsttrump trumpliedpeopledied trumpprojection gopsuperspreaders toobigtorig toorealtosteal,278038424.0,29.7589382,-95.3676974,Houston,United States of America,Texas,TX,Social Security,0.5213258266448975,the author opposes Social Security or supports cutting Social Security benefits
1.3233280142734172e+18,how much did you get for fed and state refund in 2019 what was it combined 100k great public service you make 943k and collect social security trump trump2020 bidenharris,578731170.0,39.5162234,-76.9382069,,United States of America,Maryland,MD,Social Security,0.5739263892173767,the author does not express a clear stance on Social Security
1.323328824378118e+18,why trump hates socialsecurity trumphatesseniors trumphatesourmilitary trumphatesourveterans votebidenharris floridaforbiden trumpisatraitor trumpisataxcheat trumpchinabankaccount,267365480.0,27.3364347,-82.5306527,Sarasota,United States of America,Florida,FL,Social Security,0.520518958568573,the author opposes Social Security or supports cutting Social Security benefits
1.323339446943576e+18,a vote for donaldtrump means a vote for taking away social security peoples fixed income that they and employers paid into leaving many broke destitute and needing to rely on family to support them or they will die this will affect people in all political parties,32492987.0,36.7014631,-118.7559974,,United States of America,California,CA,Social Security,0.8041993975639343,the author opposes Social Security or supports cutting Social Security benefits
1.3233447102121943e+18,trumpdeliverednothing votebiden harrisletswinthis trumpcutssocialsecurity justicematters trump showupandvote trumphatesourtroops voteagainsttrump trumpliedpeopledied votehimout trumpprojection gopsuperspreaders toobigtorig toorealtosteal,278038424.0,29.7589382,-95.3676974,Houston,United States of America,Texas,TX,Social Security,0.4741513431072235,the author opposes Social Security or supports cutting Social Security benefits
1.3233456153472205e+18,trumpdeliverednothing votebiden harrisletswinthis trumpcutssocialsecurity justicematters trump showupandvote trumphatesourtroops voteagainsttrump trumpliedpeopledied votehimout trumpprojection gopsuperspreaders toobigtorig toorealtosteal,278038424.0,29.7589382,-95.3676974,Houston,United States of America,Texas,TX,Social Security,0.4741513431072235,the author opposes Social Security or supports cutting Social Security benefits
1.3233460454268723e+18,trumpdeliverednothing votebiden harrisletswinthis trumpcutssocialsecurity justicematters trump showupandvote trumphatesourtroops voteagainsttrump trumpliedpeopledied votehimout trumpprojection gopsuperspreaders toobigtorig toorealtosteal,278038424.0,29.7589382,-95.3676974,Houston,United States of America,Texas,TX,Social Security,0.4741513431072235,the author opposes Social Security or supports cutting Social Security benefits
1.3233463973122867e+18,projecting again trumpdeliverednothing votebiden harrisletswinthis trumpcutssocialsecurity justicematters trump showupandvote trumphatesourtroops voteagainsttrump trumpliedpeopledied votehimout trumpprojection gopsuperspreaders toobigtorig toorealtosteal,278038424.0,29.7589382,-95.3676974,Houston,United States of America,Texas,TX,Social Security,0.4679738283157348,the author opposes Social Security or supports cutting Social Security benefits
1.3233467864597873e+18,trumpdeliverednothing votebiden harrisletswinthis trumpcutssocialsecurity justicematters trump showupandvote trumphatesourtroops voteagainsttrump trumpliedpeopledied votehimout trumpprojection gopsuperspreaders toobigtorig toorealtosteal,278038424.0,29.7589382,-95.3676974,Houston,United States of America,Texas,TX,Social Security,0.4741513431072235,the author opposes Social Security or supports cutting Social Security benefits
1.3233469292171346e+18,moron trumpdeliverednothing votebiden harrisletswinthis trumpcutssocialsecurity justicematters trump showupandvote trumphatesourtroops voteagainsttrump trumpliedpeopledied votehimout trumpprojection gopsuperspreaders toobigtorig toorealtosteal,278038424.0,29.7589382,-95.3676974,Houston,United States of America,Texas,TX,Social Security,0.4580776691436767,the author opposes Social Security or supports cutting Social Security benefits
1.323347126705922e+18,projecting fools trumpdeliverednothing votebiden harrisletswinthis trumpcutssocialsecurity justicematters trump showupandvote trumphatesourtroops voteagainsttrump trumpliedpeopledied votehimout trumpprojection gopsuperspreaders toobigtorig toorealtosteal,278038424.0,29.7589382,-95.3676974,Houston,United States of America,Texas,TX,Social Security,0.4823538362979889,the author opposes Social Security or supports cutting Social Security benefits
