tweet_id,clean_tweet,user_id,lat,long,city,country,state,state_code,political_label,label_score,stance
1.318021487299756e+18,dou you think joebiden supporters understand that supporters of the reelection think their candidate and supporters the same as they think of us we are just nicer about it but we vote and our issues mean more to us ie abortion,2427399097.0,38.05518,-122.74886,,United States of America,California,CA,Abortion,0.782098114490509,Pro-Choice
1.3180350409205064e+18,catholic sister endorses joebiden with a beautifully stated argument about abortion as a matter of religious liberty,7.45458689067221e+17,32.7174209,-117.1627714,San Diego,United States of America,California,CA,Abortion,0.7856355309486389,Pro-Life
1.318225516575494e+18,potus doesnt decide roe v wade and scotus has basically been set by rs cannot change that amp cause your parents grief even if he wanted to biden will at the very least halt the destruction of our democracy by whos always been prochoice anyway,1.242866917016318e+18,40.7127281,-74.0060152,New York,United States of America,New York,NY,Abortion,0.4230142533779144,Pro-Choice
1.318238038959526e+18,biden doubles down on abortion pledge biden abortion bioethics medicalethics,8.007351778151793e+17,39.9527237,-75.16352619999999,Philadelphia,United States of America,Pennsylvania,PA,Abortion,0.9310888051986694,Pro-Choice
1.3182380624979272e+18,well if you want twisted warped and evil things like transgender bathrooms and children along with abortion no matter at what term the womans pregnancy is then joebiden is your guy,1.022206650818736e+18,27.7567667,-81.4639835,,United States of America,Florida,FL,Abortion,0.8989137411117554,Pro-Choice
1.318239127389823e+18,if you want twisted and warped things like higher taxes censorship of faith unlimited abortion and both transgender children and bathrooms then you can go ahead and vote for joebiden but as for me im voting trump2020tosaveamerica kag maga catholicsfortrump,1.022206650818736e+18,27.7567667,-81.4639835,,United States of America,Florida,FL,Abortion,0.573515772819519,Pro-Life
1.3182609564350833e+18,baby murders for biden,4805985015.0,47.0451022,-122.8950075,Olympia,United States of America,Washington,WA,Abortion,0.785934329032898,Neutral
1.3182876219577836e+18,so you are professing to be a christian but promoting abortion and killing the newborn by supporting biden and encouraging others to vote for biden,3883230133.0,31.8160381,-99.5120986,,United States of America,Texas,TX,Abortion,0.939000964164734,Pro-Choice
1.3182894641338982e+18,by endorsing biden you acknowledge your support for abortion and killing of the newbornyou cannot serve two masters and you have chosen not to serve god,3883230133.0,31.8160381,-99.5120986,,United States of America,Texas,TX,Abortion,0.8463117480278015,Pro-Choice
1.3183335838624358e+18,adam schiff he is so far gone he went early all in with tds so far he cant come back he is in a bubble of delusion that is about to pop he will never be the same obamgate and bidens disease,69366271.0,32.2666506,-97.1785429,,United States of America,Texas,TX,Abortion,0.4791452884674072,Pro-Choice
1.3183723370418954e+18,pastor as a shepard why are you supporting joebiden who is favor of abortion endless wars and higher taxes u do know the real racist is joebiden check his k ties has joe condemn white supremacists blackvoicesfortrump maga,4581309612.0,36.7014631,-118.7559974,,United States of America,California,CA,Abortion,0.6739519834518433,Pro-Choice
1.31842783249895e+18,60 million americans have been murdered since 12273 bc of the party that joebiden represents as their presidential candidate jesus doesnt support abortion,421152181.0,35.6729639,-79.03929190000001,,United States of America,North Carolina,NC,Abortion,0.8913772106170654,Neutral
1.318538422500397e+18,charles g finney and pelegius both denied original sin psalm 515 583 romans 512 and thus denied the need for a new birth unto righteousness through the blood atonement of jesus christ john 33 2 cor517 lgbtq abortionlaw feminist biden pence satanism repent,1.3147395045955052e+18,35.7730076,-86.28200809999998,,United States of America,Tennessee,TN,Abortion,0.5973320007324219,Neutral
1.3186367081083167e+18,joebiden thinks you should pay for infanticide,529556135.0,44.9772995,-93.2654692,Minneapolis,United States of America,Minnesota,MN,Abortion,0.5969623327255249,Pro-Life
1.3186444062289306e+18,telling you to vote biden bidenharris trump2020 election2020 politics republicansforbiden democrats presidentialdebate2020 terminator arnold,32319552.0,34.0536909,-118.242766,Los Angeles,United States of America,California,CA,Abortion,0.5438289046287537,Pro-Choice
1.3186655332738376e+18,joebiden abortionismurder trump2020nowmorethanever,4697146016.0,38.475840600000005,-80.84084150000001,,United States of America,West Virginia,WV,Abortion,0.8292858600616455,Pro-Life
1.3186674566851994e+18,abortionismurder joebiden kamalaharris,4697146016.0,38.475840600000005,-80.84084150000001,,United States of America,West Virginia,WV,Abortion,0.8672851920127869,Pro-Life
1.318724290624344e+18,chooselife joebidenissick joebiden is pro abortion my baby was born a miracle of god at 23 weeks and she is perfect,860462443.0,27.7567667,-81.4639835,,United States of America,Florida,FL,Abortion,0.8850045204162598,Pro-Choice
1.3189079728740966e+18,coward what a baby trumpisacoward trumpchinabankaccount biden,7.169956727555973e+17,35.9603948,-83.92102609999999,Knoxville,United States of America,Tennessee,TN,Abortion,0.4159859716892242,Pro-Life
1.3189100925368033e+18,they say that theyre prolife thats always been a myth they are evil every last trumper and those who are secretly trump they are hypocrites and bastards dont believe anything that they say bidenharris2020,1538733721.0,39.7392364,-104.9848623,Denver,United States of America,Colorado,CO,Abortion,0.5478981733322144,Pro-Choice
1.3189143944500224e+18,ms catlicos quieren que roe v wade se mantenga en lugar de revertirse noticiascristianas catolicos encuesta roevwade aborto joebiden eeuu,14519812.0,29.7589382,-95.3676974,Houston,United States of America,Texas,TX,Abortion,0.7228308916091919,Pro-Life
1.3189334320979313e+18,vp debate 2012 joe bidens views on abortion religion seekthetruth catholicsforbiden catholictwitter wednesdaywisdom wednesdaymorning truth prolife chooselife antiabortion catholicchurch so much for a devout amp practicing catholic,40311716.0,33.448436699999995,-112.0741417,Phoenix,United States of America,Arizona,AZ,Abortion,0.7749894261360168,Pro-Life
1.3189524001667525e+18,but you dont care when science says life begins at conception and the child has its own unique dna if you truly believe in science then you are aware that abortion is murder and youre an advocate for the murder of millions every year biden dems,7.085525514074685e+17,40.3270127,-86.1746933,,United States of America,Indiana,IN,Abortion,0.8787286281585693,Pro-Choice
1.318952460812231e+18,joebiden dont get me twisted i only vote republicanbecause my ex equates birth control to abortionso i despise her amp abortionif you do get elected you should wipe your ass on foxnews they are liars extraordinaire cnn is real news foxnews is media entertainment fake fucks,4072327265.0,39.7683331,-86.1583502,Indianapolis,United States of America,Indiana,IN,Abortion,0.6491531729698181,Pro-Life
1.3190003581322527e+18,nuevo testamento recargado pronto clnica para abortar en el vaticano y susbasta de nios para hacer cositas ademas ya biden dijo que un nio de 8 aos puede decidir si hacer o no hacer cositas,48204107.0,36.7014631,-118.7559974,,United States of America,California,CA,Abortion,0.8536494970321655,Pro-Life
1.319043978180907e+18,if the democrat party was really proscience theyd be against abortion democrats republican joewileadus votebiden biden trump2020,26313306.0,35.2232745,-80.8474339,Charlotte,United States of America,North Carolina,NC,Abortion,0.7791141271591187,Neutral
1.3190500704115425e+18,if has more debates with hope shell ask his stance on proact national version of ab5 that from biden on down support as a donor i asked his campaign 10x never got answer arizona is righttowork state which proact seeks to end,11765962.0,34.0536909,-118.242766,Los Angeles,United States of America,California,CA,Abortion,0.8013947606086731,Pro-Life
1.319113472844714e+18,please note during the same 47 years biden has held office usa abortion murdered 6000 innocent unborn babies and biden was and is still ok with all those violent deaths shame on biden amp the democrats votetrump2020 chooselife,34157839.0,45.1895845,-88.7321585,,United States of America,Wisconsin,WI,Abortion,0.9552575945854188,Pro-Choice
1.3191177393326858e+18,election2020 joebiden abortion,354452162.0,29.7589382,-95.3676974,Houston,United States of America,Texas,TX,Abortion,0.8271063566207886,Pro-Choice
1.3191333879620936e+18,truth truth is biden will continue to authorize and enable the murder of millions of babies in the womb,78671961.0,40.0796606,-89.4337288,,United States of America,Illinois,IL,Abortion,0.7582084536552429,Pro-Life
1.3191413955385836e+18,my how times change i dont like the supreme court decision on abortion i think it went too far i dont think that a woman has the sole right to say what should happen to her body june 1 1974 biden trump2020 trump2020landslide,40162517.0,33.4503998,-88.8183872,,United States of America,Mississippi,MS,Abortion,0.9263190627098083,Pro-Life
1.319248784866554e+18,many either dont know or dont believe that biden will destroy our country more taxes that will hurt the working class and further place families in debt abortion even born alive and late term murder supports open borders ms13 drug cartels access to you,17367875.0,27.77308,-82.40759,,United States of America,Florida,FL,Abortion,0.6312437057495117,Neutral
1.3192708906689208e+18,lets talk about your abortions and how many has trump had im voting for joebiden,8.171076967341752e+17,36.7014631,-118.7559974,,United States of America,California,CA,Abortion,0.943211793899536,Pro-Choice
1.3193065684254966e+18,joebiden for eight years as vice president the military shrunk we lost millions of jobs the economy tanked and more than 126140 babies were aborted and now he wants to be president america cannot afford a bidenadministration voteredtosaveamerica trump2020,1.3031785882425385e+18,34.2331373,-102.4107493,,United States of America,Texas,TX,Abortion,0.4344986975193023,Pro-Life
1.319316426964992e+18,why is it necessary to explain to fellow catholics that you cannot vote for a person that grows supports or promotes abortion you would think the teaching thou shalt not kill would be sufficient enough but here i am telling another catholic she cannot vote for biden,629464404.0,29.949932300000004,-90.0701156,New Orleans,United States of America,Louisiana,LA,Abortion,0.8587843775749207,Pro-Life
1.3193373405324124e+18,abortion abortionontrial abortionrights women birth people vote votecommongood vote2020 trumppence bidenharris donaldjtrump joebiden life babiesprolife prochoice,21526765.0,38.8949924,-77.0365581,Washington,United States of America,District of Columbia,DC,Abortion,0.7406931519508362,Pro-Life
1.3194169936073974e+18,in only arizona senate debate said markkelly was trying to say basically nothing to get elected she might want to ask if kelly agrees with joebiden support of proact national ab5 that will wipe out arizonas righttowork law,11765962.0,34.0536909,-118.242766,Los Angeles,United States of America,California,CA,Abortion,0.5449305772781372,Pro-Choice
1.3194182647289242e+18,i want to know about trump raping women how many how many abortions has he paid for what about his chinas bank account the money he owes lets talk about the money stolen from charities how his kids helpedwhat about that investigation into eric im voting for joebiden,8.171076967341752e+17,36.7014631,-118.7559974,,United States of America,California,CA,Abortion,0.4828976690769195,Pro-Life
1.31943891882419e+18,this woman told me that joebiden was corrupt as well as trump today i just continued to explain to her why conservative views on abortion is bullshit i think i started to win her over a little got to stay on topic haha,276809102.0,34.2331373,-102.4107493,,United States of America,Texas,TX,Abortion,0.8552525043487549,Pro-Choice
1.3194597131600404e+18,the criminal here tonight debates2020 is biden because he wants babys dead through abortion,1.0522819292387532e+18,27.7567667,-81.4639835,,United States of America,Florida,FL,Abortion,0.7061036825180054,Pro-Life
1.3194610338875845e+18,because biden amp his liberal democrats are antiamerican killing its babies with abortion amp killing american jobs by cozying up to china,23629944.0,43.08217929999999,-73.7853915,,United States of America,New York,NY,Abortion,0.8031587600708008,Pro-Life
1.3194611681219994e+18,debates2020 biden hay racismo en amrica,2216773626.0,33.448436699999995,-112.0741417,Phoenix,United States of America,Arizona,AZ,Abortion,0.4515506029129028,Pro-Life
1.3194652654789304e+18,wow even joebiden laughed at the aoc plus three line pretty funny debates2020,2652620492.0,44.4308975,-89.6884637,,United States of America,Wisconsin,WI,Abortion,0.4596648514270782,Pro-Choice
1.31947114515499e+18,so now aocplus3 is the new boogeyman the new antifa lol trumpmeltdown debates joebiden,1328083423.0,38.8949924,-77.0365581,Washington,United States of America,District of Columbia,DC,Abortion,0.5190989971160889,Pro-Choice
1.3194723789303194e+18,why didnt they bring up in the debate the video of biden bragging about threatening ukraine abt firing the prosecutor or obamabiden would hold back millions of,122919625.0,36.7014631,-118.7559974,,United States of America,California,CA,Abortion,0.6174596548080444,Pro-Life
1.3195012324075151e+18,a millennial looking man prolifer in nc focus group just said hes still undecided waiting to see about acb amp if she gets on the court if she does he will vote for biden if not hes not sure yet hey buddy my advice vote amp dont have an abortion omg biden,838135729.0,34.0536909,-118.242766,Los Angeles,United States of America,California,CA,Abortion,0.7615888118743896,Neutral
1.3195117253816484e+18,democrats outnumber republicans in this country and our margin will continue to grow if acb is confirmed we need to make sure the gop never has power to do this ever again retweet amycomeybarrett debates retwet 2020debate 2020presidentialdebate biden blm,4420629449.0,27.7567667,-81.4639835,,United States of America,Florida,FL,Abortion,0.4553169310092926,Pro-Choice
1.3195354116440146e+18,biden wants to turn this nation into a cesspool decency is what you want but hes for abortion unrestricted lawlessness which means any time people feel that the law doesnt fit there lifestyle they want to create a new one,3292026279.0,42.1167065,-86.4541894,,United States of America,Michigan,MI,Abortion,0.9290814399719238,Neutral
1.319621214671876e+18,joebiden joebidenlies obabacare,1915235287.0,40.7127281,-74.0060152,New York,United States of America,New York,NY,Abortion,0.7050600647926331,Pro-Life
1.319649626681725e+18,vote prolife vote for the most prolife president weve ever had in name only catholic biden is pro abortion amp so is his running mate,581739356.0,39.2908816,-76.610759,Baltimore,United States of America,Maryland,MD,Abortion,0.8284728527069092,Pro-Life
1.319697986671313e+18,first how can any person of faith vote for joebiden supporter of killing innocent babies in the womb,1.31043969540343e+18,33.68119,-84.434525,,United States of America,Georgia,GA,Abortion,0.8133740425109863,Pro-Choice
1.319755942213292e+18,so joebiden says the potus is responsible for all of the covid19 deaths get real democrats how many babies have yall killed trump2020 abortionismurder,3390709383.0,32.9715645,-89.7348497,,United States of America,Mississippi,MS,Abortion,0.7265931367874146,Pro-Choice
1.3197841783306568e+18,it is baffling to assume that proabortion policies kill more people than a culturesaturating proself pride protrump trump2020 maga prolife prochoice biden,145028570.0,34.0536909,-118.242766,Los Angeles,United States of America,California,CA,Abortion,0.8797600865364075,Pro-Choice
1.319804735034151e+18,if you call yourself a christian it is incumbent upon you to vote against joebiden and kamalaharris and vote prochristian a vote for democrats is a vote for abortion euthanasia socialism samesexmarriage antifa antiflag antichristianity antifamily antiamerican evil,1.3031785882425385e+18,34.2331373,-102.4107493,,United States of America,Texas,TX,Abortion,0.7114331722259521,Pro-Life
1.31981365631463e+18,biden you will face judgement before a mighty god prolife voteforher,1.1592198217850348e+18,35.873371,-87.342996,,United States of America,Tennessee,TN,Abortion,0.5166300535202026,Pro-Life
1.3199731920779018e+18,trump stands on the shoulders of the obamabiden administration and calls himself tall,475014039.0,33.687438799999995,-80.4363743,,United States of America,South Carolina,SC,Abortion,0.6630309224128723,Pro-Choice
1.3200465126222277e+18,do texas values include letting a deadly virus run unchecked through the state the repub president holds superspreader rallies no social distancing and few masks joebiden holds drivein rallies and encourages people to wear masks which one is prolife gopsuperspreaders,8.25057711134036e+17,29.7589382,-95.3676974,Houston,United States of America,Texas,TX,Abortion,0.4492222964763641,Pro-Life
1.320056756136018e+18,the irony is that hes putting his own supporters at risk many of whom will also be hurt if the aca is reversed as well as preexisting conditions like as biden points out covid,7.309044096312484e+17,29.101628100000003,-81.01059620000001,,United States of America,Florida,FL,Abortion,0.5108285546302795,Pro-Choice
1.320069736558977e+18,our lady of guadalupe also known as the mother of the americas we have her image center to our lives as catholic we are called to vote for life and therefore based on the abortion factor i cannot support joebiden or many democrats for that matter votered,1.3031785882425385e+18,34.2331373,-102.4107493,,United States of America,Texas,TX,Abortion,0.8480147123336792,Pro-Life
1.320089229888729e+18,the sign says it all obamainfl joebiden voteearlyday,23550840.0,40.0796606,-89.4337288,,United States of America,Illinois,IL,Abortion,0.4037556648254394,Pro-Life
1.3200923836446843e+18,a take i havent seen yet rushing through acb nomination bc if not and biden wins election2020 then obama gets the supreme court nod,3326115749.0,28.5421109,-81.3790304,Orlando,United States of America,Florida,FL,Abortion,0.4748100042343139,Pro-Choice
1.3201163064908554e+18,trumps rally is beginning and there are three nuns behind him praying wearing maga mask holding up the holy bible wow excommunicated joe biden doesnt have any nuns at his rally but he professes to be a catholic still in spite of his pro abortion platform what a phony,21941446.0,42.3602534,-71.0582912,Boston,United States of America,Massachusetts,MA,Abortion,0.4228087365627289,Pro-Choice
1.3201540960207094e+18,my fellow americans god forbid if joebiden wins the 2020election then youd better get ready for higher taxes transgender bathrooms and children abortion no matter what term the pregnancy is at and censorship of faith think about that before you go to votebidenharris,1.022206650818736e+18,27.7567667,-81.4639835,,United States of America,Florida,FL,Abortion,0.548535943031311,Pro-Life
1.3201562727469548e+18,biden claims hes catholic true a baptized catholic a self excommunicated catholic through his pro abortion stance causing scandal amongst catholics christians must vote pro life not embrace the darkness of the democratic party and loose eternal life trump4life2020,241733133.0,42.3788774,-72.03236600000001,,United States of America,Massachusetts,MA,Abortion,0.8073543906211853,Pro-Life
1.3201869216839967e+18,plus you pale in comparison to obamaif by chance you do repeal acabiden will reverse the desicion then impeach acb like the whore that she is,799406750.0,39.7392364,-104.9848623,Denver,United States of America,Colorado,CO,Abortion,0.5658029317855835,Pro-Choice
1.3201970278803415e+18,bidenharris are the most antilife presidential ticket ever even supporting the horrors of lateterm abortions and infanticide joebiden,8.211950556376023e+17,27.7567667,-81.4639835,,United States of America,Florida,FL,Abortion,0.8543701767921448,Pro-Life
1.320208935647957e+18,like someone on tv said i think it was laura ingraham on please stop calling yourself prolife if you plan to vote for basement biden or any other proabortionprochoicepro baby murder candidate,34157839.0,45.1895845,-88.7321585,,United States of America,Wisconsin,WI,Abortion,0.8706695437431335,Pro-Choice
1.3202094791584522e+18,you were never a republican trying to shame three nuns who support president trump is what a democrat operative does i dont see how anyone with the least amount of decency can support democrats amp joebiden abortion on demand medicare for all open borders socialism etc,4691273378.0,29.5466001,-95.0319751,,United States of America,Texas,TX,Abortion,0.6913805603981018,Pro-Choice
1.3203929650852495e+18,confirmamyconeybarrett biden pelosi democats we want judgeamyconeybarrett abortion is not birth control stop killing black babies blm,1.2769651863608648e+18,43.6211955,-84.6824346,,United States of America,Michigan,MI,Abortion,0.8939542174339294,Pro-Life
1.3204651167609774e+18,biden ukraineelection2020 obamabidengate hunterbidenlaptop,1.2355967272073912e+18,36.7014631,-118.7559974,,United States of America,California,CA,Abortion,0.5595296621322632,Pro-Choice
1.3205367905587569e+18,joebiden joebiden2020 bidenharris democrats abortion racism socialism marxism marxistfeminism youaintblack blexit joebidenisaracist makeamericafreeagain makeamericagreatagain maga trump2020 trumppence2020 everythingchristian christianity jesusmatters,63546319.0,40.7127281,-74.0060152,New York,United States of America,New York,NY,Abortion,0.6087596416473389,Pro-Choice
1.320540999060394e+18,his father biden has shown hes a corrupt buyable politician not willing to oppose late term abortion the democratic rampant antisemitism who needs hunter the family is a disgrace,1948706858.0,34.1688075,-118.53611979999998,Los Angeles,United States of America,California,CA,Abortion,0.801909863948822,Pro-Choice
1.320602118487769e+18,when biden and his cult claim hes catholic do they even know what they are saying newsflash catholics so not believe in abortion and despite what the pope has said homosexuality is a sin according to the bible you cant be both,54435182.0,39.9423676,-75.0875874,Camden,United States of America,New Jersey,NJ,Abortion,0.8091816306114197,Pro-Life
1.320745377541296e+18,beware of false prophets this pope whose viewpoint goes against scripture is not supported by all catholics catholics supporting joebiden amp any other proabortion politician are guilty of mortal sin votetrump2020tosaveamerica,166134301.0,30.8703881,-92.007126,,United States of America,Louisiana,LA,Abortion,0.7177688479423523,Pro-Life
1.320806141450834e+18,this woman voted with nancy pelosi over 90 of the time she has yet to denounce biden antifaterrorists late term abortion she does support gay life sodomy anal sex between males open borders,3275091259.0,36.1672559,-115.1485163,Las Vegas,United States of America,Nevada,NV,Abortion,0.7841446995735168,Neutral
1.320862777922105e+18,aqui tienes los vdeos se filtra contenido sexual del hijo de joebiden,1.2786568401806008e+18,25.7741728,-80.19362,Miami,United States of America,Florida,FL,Abortion,0.5118808746337891,Neutral
1.3209090870439526e+18,i wonder how many women shudder remembering what is what like before abortion was legal back alley doctors coat hooks throwing oneself down stairs the fear and shame whatsatstake vote biden votebluedownballot,8.225959683654492e+17,40.2253569,-82.6881395,,United States of America,Ohio,OH,Abortion,0.672980546951294,Pro-Choice
1.3209142094172938e+18,im so excited for joebiden to send 45 back to florida where he is hopefully eaten by an alligator while we the people flipthesenate and legislate the right to abortion the right to marry pass the fucking era abolish the filibuster amp abolish the electoral college justdoit,125534222.0,47.6038321,-122.3300624,Seattle,United States of America,Washington,WA,Abortion,0.7563444972038269,Pro-Choice
1.320919548158161e+18,this is just part of the degradation now awaiting women nationwide pray for joebiden to win or life for women will cease as we know it,9.975761678919148e+17,27.7567667,-81.4639835,,United States of America,Florida,FL,Abortion,0.4155748784542084,Pro-Life
1.320967038823813e+18,dont be fooled by joebidens catholicity biden is simply a badcatholic his views and stances put him at odds with catholicdoctrine biden supports abortion including late term abortion he supports euthanasia for any reason christians must never vote for him,1.3031785882425385e+18,34.2331373,-102.4107493,,United States of America,Texas,TX,Abortion,0.7431108951568604,Pro-Life
1.3210907989272044e+18,abortion isnt the only issue at stake and with the confirmation of justice barrett it is even less of a concern i wont vote for someone who displays not fruit of the spirit but who regularly displays all of the things the bible says god hates christiansagainsttrump biden,114614724.0,38.7251776,-105.6077167,,United States of America,Colorado,CO,Abortion,0.771105945110321,Neutral
1.3211291978725663e+18,intrinsicevildescribes a human acts that can never be morally justified or permitted like the killing of over six million jews in germany another example that is never mentioned is abortion which joebiden supports now that you know this it is up to you to votefortrump,1.3031785882425385e+18,34.2331373,-102.4107493,,United States of America,Texas,TX,Abortion,0.9283142685890198,Neutral
